{"dados": [
    {
      "bloco": "Império da Tijuca",
      "bairro": "Tijuca",
      "região": "Tijuca e Adj",
      "data": "22/01/17",
      "data relativa": "",
      "concentração": "2017-01-22T19:00:00-02:00",
      "desfile": "2017-01-22T20:00:00-02:00",
      "final": "2017-01-22T22:00:00-02:00",
      "local da concentracao": "Rua Conde de Bonfim, esquina com Rua José Higino",
      "percurso": "Rua Conde de Bonfim, da Rua José Higino até a Rua Uruguai",
      "público estimado": "3000",
      "ano do primeiro desfile": "1940"
    },
    {
      "bloco": "Bigode Esticado",
      "bairro": "Méier",
      "região": "Zona Norte 2",
      "data": "29/01/17",
      "data relativa": "Domingo - 4 semanas antes do Carnaval",
      "concentração": "2017-01-29T15:00:00-02:00",
      "desfile": "2017-01-29T18:00:00-02:00",
      "final": "2017-01-29T21:00:00-02:00",
      "local da concentracao": "Rua Dias da Cruz, no 255",
      "percurso": "Rua Dias da Cruz, no 255 - Parado",
      "público estimado": "1000",
      "ano do primeiro desfile": "1999"
    },
    {
      "bloco": "Independente do Morro do Pinto",
      "bairro": "Santo Cristo",
      "região": "Centro",
      "data": "03/02/17",
      "data relativa": "Sexta-Feira - 3 semanas antes do Carnaval",
      "concentração": "2017-02-03T18:00:00-02:00",
      "desfile": "2017-02-03T19:00:00-02:00",
      "final": "2017-02-03T22:00:00-02:00",
      "local da concentracao": "Rua Farnese, em frente ao no 83",
      "percurso": "Rua Farnese, Rua Mariano Procópio, Rua Mont Alverne, Rua Sara, Rua Santo Cristo, Rua Waldemar Dutra",
      "público estimado": "1000",
      "ano do primeiro desfile": "1972"
    },
    {
      "bloco": "Badalo de Santa Teresa",
      "bairro": "Santa Teresa",
      "região": "Centro",
      "data": "03/02/17",
      "data relativa": "Sexta-feira - 3 semanas antes do Carnaval",
      "concentração": "2017-02-03T19:00:00-02:00",
      "desfile": "2017-02-03T20:00:00-02:00",
      "final": "2017-02-04T01:00:00-02:00",
      "local da concentracao": "Largo das Neves",
      "percurso": "Largo das Neves - Parado",
      "público estimado": "1500",
      "ano do primeiro desfile": "1972"
    },
    {
      "bloco": "Os \"20\" de Ouro do Mestre Odilon",
      "bairro": "Ilha do Governador",
      "região": "Zona Norte 3",
      "data": "04/02/17",
      "data relativa": "Sábado - 3 semanas antes do Carnaval",
      "concentração": "2017-02-04T14:00:00-02:00",
      "desfile": "2017-02-04T17:00:00-02:00",
      "final": "2017-02-04T20:00:00-02:00",
      "local da concentracao": "Estrada do Rio Jequiá (Posto Necker Pinto)",
      "percurso": "Segue pela Rua Praia so Jequiá, Rua Maldonado, e Pça Iaiá Garcia",
      "público estimado": "4000",
      "ano do primeiro desfile": "2017"
    },
    {
      "bloco": "Banda de Ipanema - Ensaio",
      "bairro": "Ipanema",
      "região": "Zona Sul",
      "data": "04/02/17",
      "data relativa": "Sábado - 3 semanas antes do Carnaval",
      "concentração": "2017-02-04T15:00:00-02:00",
      "desfile": "2017-02-04T16:00:00-02:00",
      "final": "2017-02-04T20:00:00-02:00",
      "local da concentracao": "Praca General Osório",
      "percurso": "Praça General Osório - Parado",
      "público estimado": "5000",
      "ano do primeiro desfile": "1965"
    },
    {
      "bloco": "Beijo Quente",
      "bairro": "Fazenda Botafogo",
      "região": "Zona Norte 1",
      "data": "04/02/17",
      "data relativa": "Sábado - 3 semanas antes do Carnaval",
      "concentração": "2017-02-04T15:00:00-02:00",
      "desfile": "2017-02-04T17:00:00-02:00",
      "final": "2017-02-04T20:00:00-02:00",
      "local da concentracao": "Rua Pedro Jório",
      "percurso": "Rua Pedro Jório, Rua Vitor Frond, Rua Ouseley, Rua Prefeito Sá Lessa e Rua Pedro Jório",
      "público estimado": "500",
      "ano do primeiro desfile": "2014"
    },
    {
      "bloco": "É Pequeno mas não amolece",
      "bairro": "Recreio",
      "região": "Barra/JPA",
      "data": "04/02/17",
      "data relativa": "Sábado - 3 semanas antes do Carnaval",
      "concentração": "2017-02-04T15:00:00-02:00",
      "desfile": "2017-02-04T17:00:00-02:00",
      "final": "2017-02-04T21:00:00-02:00",
      "local da concentracao": "Praça Professor Henrique Niremberg",
      "percurso": "Parado",
      "público estimado": "500",
      "ano do primeiro desfile": "2009"
    },
    {
      "bloco": "Eles que Digam",
      "bairro": "Santo Cristo",
      "região": "Centro",
      "data": "04/02/17",
      "data relativa": "Sábado - 3 semanas antes do Carnaval",
      "concentração": "2017-02-04T15:00:00-02:00",
      "desfile": "2017-02-04T16:00:00-02:00",
      "final": "2017-02-04T21:00:00-02:00",
      "local da concentracao": "Travessa São Diogo",
      "percurso": "Travessa São Diogo, seguindo pela Rua Nabuco de Freitas até a Rua da América e retornando pela Nabuco de Freitas até a Travessa São Diogo",
      "público estimado": "800",
      "ano do primeiro desfile": "1975"
    },
    {
      "bloco": "Larga a Onça, Alfredo! - Ensaio",
      "bairro": "Laranjeiras",
      "região": "Zona Sul",
      "data": "04/02/17",
      "data relativa": "Sábado - 3 semanas antes do Carnaval",
      "concentração": "2017-02-04T15:00:00-02:00",
      "desfile": "2017-02-04T18:00:00-02:00",
      "final": "2017-02-04T20:00:00-02:00",
      "local da concentracao": "Praça São Salvador",
      "percurso": "Praça São Salvador - Parado",
      "público estimado": "1000",
      "ano do primeiro desfile": "2008"
    },
    {
      "bloco": "Liga de Blocos e Bandas da Zona Portuária",
      "bairro": "Saúde",
      "região": "Centro",
      "data": "04/02/17",
      "data relativa": "Sábado - 3 semanas antes do Carnaval",
      "concentração": "2017-02-04T18:00:00-02:00",
      "desfile": "2017-02-04T19:00:00-02:00",
      "final": "2017-02-05T00:00:00-02:00",
      "local da concentracao": "Praça Coronel Assunção (Praça da Harmonia)",
      "percurso": "Rua Sacadura Cabral, da Praça da Harmonia até o Largo São Francisco da Prainha",
      "público estimado": "3000",
      "ano do primeiro desfile": "2008"
    },
    {
      "bloco": "Seu Kuka",
      "bairro": "Grajaú",
      "região": "Tijuca e Adj",
      "data": "04/02/17",
      "data relativa": "Sábado - 3 semanas antes do Carnaval",
      "concentração": "2017-02-04T15:00:00-02:00",
      "desfile": "2017-02-04T15:00:00-02:00",
      "final": "2017-02-04T21:00:00-02:00",
      "local da concentracao": "Rua Emilia Sampaio",
      "percurso": "Parado",
      "público estimado": "1000",
      "ano do primeiro desfile": "2007"
    },
    {
      "bloco": "Só Caminha",
      "bairro": "Botafogo",
      "região": "Zona Sul",
      "data": "05/02/17",
      "data relativa": "Domingo - 3 semanas antes do Carnaval",
      "concentração": "2017-02-05T12:00:00-02:00",
      "desfile": "2017-02-05T14:00:00-02:00",
      "final": "2017-02-05T18:00:00-02:00",
      "local da concentracao": "Largo dos Leões",
      "percurso": "Largo dos Leões, Rua Marques, Rua Capistrano de Abreu, Rua Conde de Irajá e Largo dos Leões",
      "público estimado": "2500",
      "ano do primeiro desfile": "2010"
    },
    {
      "bloco": "Banda do Jiló",
      "bairro": "Tijuca",
      "região": "Tijuca e Adj",
      "data": "05/02/17",
      "data relativa": "Domingo - 3 semanas antes do Carnaval",
      "concentração": "2017-02-05T14:00:00-02:00",
      "desfile": "2017-02-05T14:00:00-02:00",
      "final": "2017-02-05T20:00:00-02:00",
      "local da concentracao": "Rua Pinto de Figueiredo, no 26",
      "percurso": "Rua Pinto de Figueiredo, no 26 - Parado",
      "público estimado": "800",
      "ano do primeiro desfile": "2004"
    },
    {
      "bloco": "Bigode Esticado",
      "bairro": "Méier",
      "região": "Zona Norte 2",
      "data": "05/02/17",
      "data relativa": "Domingo - 3 semanas antes do Carnaval",
      "concentração": "2017-02-05T15:00:00-02:00",
      "desfile": "2017-02-05T18:00:00-02:00",
      "final": "2017-02-05T21:00:00-02:00",
      "local da concentracao": "Rua Dias da Cruz, no 255",
      "percurso": "Rua Dias da Cruz, no 255 - Parado",
      "público estimado": "500",
      "ano do primeiro desfile": "1999"
    },
    {
      "bloco": "Unidos da Rego Barros",
      "bairro": "Santo Cristo",
      "região": "Centro",
      "data": "05/02/17",
      "data relativa": "Domingo - 3 semanas antes do Carnaval",
      "concentração": "2017-02-05T15:00:00-02:00",
      "desfile": "2017-02-05T17:00:00-02:00",
      "final": "2017-02-05T21:00:00-02:00",
      "local da concentracao": "Rua Rego Barros",
      "percurso": "RUA REGO BARROS, RUA DA AMÉRICA, RUA NABUCO DE FREITAS, VOLTANDO PELA RUA RUA DA AMÉRICA E RUA REGO BARROS",
      "público estimado": "800",
      "ano do primeiro desfile": "2011"
    },
    {
      "bloco": "Vai Tomar no Grajaú",
      "bairro": "Grajaú",
      "região": "Tijuca e Adj",
      "data": "05/02/17",
      "data relativa": "Domingo - 3 semanas antes do Carnaval",
      "concentração": "2017-02-05T15:00:00-02:00",
      "desfile": "2017-02-05T17:00:00-02:00",
      "final": "2017-02-05T21:00:00-02:00",
      "local da concentracao": "Av Engenheiro Richard 105",
      "percurso": "Parado",
      "público estimado": "800",
      "ano do primeiro desfile": "2009"
    },
    {
      "bloco": "Xodó da Piedade",
      "bairro": "Piedade",
      "região": "Zona Norte 2",
      "data": "05/02/17",
      "data relativa": "Domingo - 3 semanas antes do Carnaval",
      "concentração": "2017-02-05T16:00:00-02:00",
      "desfile": "2017-02-05T18:00:00-02:00",
      "final": "2017-02-05T22:00:00-02:00",
      "local da concentracao": "Rua Silvana, esquina com Rua Mario Carpenter",
      "percurso": "Rua Silvana, Rua Mario Carpenter, Rua Leopoldina, Rua João Pinheiro, Av. Dom Helder Camara, Rua Ferreira Sampaio, Rua Ernesto Nunes, Rua Mario Carpenter e Rua Silvana",
      "público estimado": "1200",
      "ano do primeiro desfile": "1972"
    },
    {
      "bloco": "Se Deixar Eu Boto",
      "bairro": "Pavuna",
      "região": "Zona Norte 1",
      "data": "10/02/17",
      "data relativa": "Sexta-feira - 2 semana antes do Carnaval",
      "concentração": "2017-02-10T16:00:00-02:00",
      "desfile": "2017-02-10T18:00:00-02:00",
      "final": "2017-02-10T20:00:00-02:00",
      "local da concentracao": "Rua Dr. José Thomás, no 920",
      "percurso": "Rua Dr. José Thomás, do no 920 ao no 435, voltando ao local de concentraçao",
      "público estimado": "1000",
      "ano do primeiro desfile": "2014"
    },
    {
      "bloco": "Unidos do Chapadão",
      "bairro": "Ramos",
      "região": "Zona Norte 3",
      "data": "10/02/17",
      "data relativa": "Sexta-feira - 2 semana antes do Carnaval",
      "concentração": "2017-02-10T17:00:00-02:00",
      "desfile": "2017-02-10T18:00:00-02:00",
      "final": "2017-02-10T22:00:00-02:00",
      "local da concentracao": "Travessa dos Campeões",
      "percurso": "Travessa dos Campeões, Avenida dos Campeões até o no 1, voltando a Travessa dos Campeões",
      "público estimado": "800",
      "ano do primeiro desfile": "2009"
    },
    {
      "bloco": "É o Bicho Folia",
      "bairro": "Irajá",
      "região": "Zona Norte 1",
      "data": "10/02/17",
      "data relativa": "Sexta-feira - 2 semana antes do Carnaval",
      "concentração": "2017-02-10T18:00:00-02:00",
      "desfile": "2017-02-10T19:00:00-02:00",
      "final": "2017-02-10T22:00:00-02:00",
      "local da concentracao": "Praça Rodrigues Galhardo",
      "percurso": "Praça Rodrigues Galhardo - Parado",
      "público estimado": "500",
      "ano do primeiro desfile": "2016"
    },
    {
      "bloco": "Badalo de Santa Teresa",
      "bairro": "Santa Teresa",
      "região": "Centro",
      "data": "10/02/17",
      "data relativa": "Sexta-feira - 2 semana antes do Carnaval",
      "concentração": "2017-02-10T19:00:00-02:00",
      "desfile": "2017-02-10T20:00:00-02:00",
      "final": "2017-02-11T01:00:00-02:00",
      "local da concentracao": "Largo das Neves",
      "percurso": "Largo das Neves - Parado",
      "público estimado": "1500",
      "ano do primeiro desfile": "1972"
    },
    {
      "bloco": "Desliga da Justiça",
      "bairro": "Gávea",
      "região": "Zona Sul",
      "data": "11/02/17",
      "data relativa": "Sábado - 2 semanas antes do Carnaval",
      "concentração": "2017-02-11T08:00:00-02:00",
      "desfile": "2017-02-11T10:00:00-02:00",
      "final": "2017-02-11T14:00:00-02:00",
      "local da concentracao": "Praça Santos Dumont",
      "percurso": "Praça Santos Dumont - Parado",
      "público estimado": "5000",
      "ano do primeiro desfile": "2010"
    },
    {
      "bloco": "Vira-Lata",
      "bairro": "Barra da Tijuca",
      "região": "Barra/JPA",
      "data": "11/02/17",
      "data relativa": "Sábado - 2 semanas antes do Carnaval",
      "concentração": "2017-02-11T09:00:00-02:00",
      "desfile": "2017-02-11T10:00:00-02:00",
      "final": "2017-02-11T14:00:00-02:00",
      "local da concentracao": "Av. do Pepê c/ Érico Veríssimo",
      "percurso": "Avenida do Pepê, da Avenida Érico Veríssimo até a Avenida Olegário Maciel",
      "público estimado": "10000",
      "ano do primeiro desfile": "2017 (2007)"
    },
    {
      "bloco": "Spanta Neném",
      "bairro": "Lagoa",
      "região": "Zona Sul",
      "data": "11/02/17",
      "data relativa": "Sábado - 2 semanas antes do Carnaval",
      "concentração": "2017-02-11T10:00:00-02:00",
      "desfile": "2017-02-11T12:00:00-02:00",
      "final": "2017-02-11T16:00:00-02:00",
      "local da concentracao": "Corte do Cantagalo",
      "percurso": "Ciclovia da Lagoa, do Corte do Cantagalo até o Clube Caiçaras",
      "público estimado": "8000",
      "ano do primeiro desfile": "2003"
    },
    {
      "bloco": "A Febre do Samba",
      "bairro": "Gamboa",
      "região": "Centro",
      "data": "11/02/17",
      "data relativa": "Sábado - 2 semanas antes do Carnaval",
      "concentração": "2017-02-11T13:00:00-02:00",
      "desfile": "2017-02-11T15:00:00-02:00",
      "final": "2017-02-11T19:00:00-02:00",
      "local da concentracao": "Rua Argemiro Bulcão",
      "percurso": "Rua Argemiro Bulcão - Parado",
      "público estimado": "1000",
      "ano do primeiro desfile": "2013"
    },
    {
      "bloco": "GB Bloco",
      "bairro": "Laranjeiras",
      "região": "Zona Sul",
      "data": "11/02/17",
      "data relativa": "Sábado - 2 semanas antes do Carnaval",
      "concentração": "2017-02-11T13:00:00-02:00",
      "desfile": "2017-02-11T15:00:00-02:00",
      "final": "2017-02-11T19:00:00-02:00",
      "local da concentracao": "Praça Jardim Laranjeiras - Rua General Glicério",
      "percurso": "Rua General Glicério, Rua General Cristóvão Barcelos, retornando à Praça Jardim Laranjeiras",
      "público estimado": "3000",
      "ano do primeiro desfile": "2007"
    },
    {
      "bloco": "Imprensa Que Eu Gamo",
      "bairro": "Laranjeiras",
      "região": "Zona Sul",
      "data": "11/02/17",
      "data relativa": "Sábado - 2 semanas antes do Carnaval",
      "concentração": "2017-02-11T13:00:00-02:00",
      "desfile": "2017-02-11T15:00:00-02:00",
      "final": "2017-02-11T19:00:00-02:00",
      "local da concentracao": "Rua Gago Coutinho, em frente ao Mercadinho São José",
      "percurso": "Rua Gago Coutinho, Largo do Machado, Rua das Laranjeiras e Rua Gago Coutinho",
      "público estimado": "10000",
      "ano do primeiro desfile": "1995"
    },
    {
      "bloco": "Banda da Praia da Bica",
      "bairro": "Ilha do Governador",
      "região": "Zona Norte 3",
      "data": "11/02/17",
      "data relativa": "Sábado - 2 semanas antes do Carnaval",
      "concentração": "2017-02-11T14:00:00-02:00",
      "desfile": "2017-02-11T16:00:00-02:00",
      "final": "2017-02-11T20:00:00-02:00",
      "local da concentracao": "Quiosque Piratas Praia da Bica",
      "percurso": "Parado",
      "público estimado": "3000",
      "ano do primeiro desfile": "2017 (2001)"
    },
    {
      "bloco": "Cadê Meu Beijo?",
      "bairro": "Portuguesa",
      "região": "Zona Norte 3",
      "data": "11/02/17",
      "data relativa": "Sábado - 2 semanas antes do Carnaval",
      "concentração": "2017-02-11T14:00:00-02:00",
      "desfile": "2017-02-11T16:00:00-02:00",
      "final": "2017-02-11T20:00:00-02:00",
      "local da concentracao": "Rua Luis Sá, em frente ao Restaurante Brazuca",
      "percurso": "Rua Luis Sá, em frente ao Restaurante Brazuca - Parado",
      "público estimado": "2000",
      "ano do primeiro desfile": "2015"
    },
    {
      "bloco": "Puxa Que É Peruca",
      "bairro": "Grajaú",
      "região": "Tijuca e Adj",
      "data": "11/02/17",
      "data relativa": "Sábado - 2 semanas antes do Carnaval",
      "concentração": "2017-02-11T14:00:00-02:00",
      "desfile": "2017-02-11T16:00:00-02:00",
      "final": "2017-02-11T19:00:00-02:00",
      "local da concentracao": "Praça Edmundo Rego",
      "percurso": "Avenida Julio Furtado, da Praça Edmundo Rego até a Rua Marechal Jofre, retornando pela Julio Furtado até a Praça Edmundo Rego",
      "público estimado": "1000",
      "ano do primeiro desfile": "2012"
    },
    {
      "bloco": "Beijo Quente",
      "bairro": "Fazenda Botafogo",
      "região": "Zona Norte 1",
      "data": "11/02/17",
      "data relativa": "Sábado - 2 semanas antes do Carnaval",
      "concentração": "2017-02-11T15:00:00-02:00",
      "desfile": "2017-02-11T17:00:00-02:00",
      "final": "2017-02-11T20:00:00-02:00",
      "local da concentracao": "Rua Pedro Jório",
      "percurso": "Rua Pedro Jório, Rua Vitor Frond, Rua Ouseley, Rua Prefeito Sá Lessa e Rua Pedro Jório",
      "público estimado": "500",
      "ano do primeiro desfile": "2014"
    },
    {
      "bloco": "Cacique de Higienópolis",
      "bairro": "Higienópolis",
      "região": "Zona Norte 2",
      "data": "11/02/17",
      "data relativa": "Sábado - 2 semanas antes do Carnaval",
      "concentração": "2017-02-11T15:00:00-02:00",
      "desfile": "2017-02-11T16:00:00-02:00",
      "final": "2017-02-11T21:00:00-02:00",
      "local da concentracao": "Rua Tamiarana, esquina com Rua Darke de Mattos",
      "percurso": "Rua Tamiarana, esquina com Rua Darke de Mattos - Parado",
      "público estimado": "1500",
      "ano do primeiro desfile": "2012"
    },
    {
      "bloco": "Fala Meu Louro",
      "bairro": "Santo Cristo",
      "região": "Centro",
      "data": "11/02/17",
      "data relativa": "Sábado - 2 semanas antes do Carnaval",
      "concentração": "2017-02-11T15:00:00-02:00",
      "desfile": "2017-02-11T17:00:00-02:00",
      "final": "2017-02-11T20:00:00-02:00",
      "local da concentracao": "Rua Waldemar Dutra, 19",
      "percurso": "Rua Waldemar Dutra, Rua do  Santo Cristo,  Rua Cardoso Marinho, Rua Barao da Gamboa e Rua Waldemar Dutra",
      "público estimado": "3000",
      "ano do primeiro desfile": "1938"
    },
    {
      "bloco": "Alegria da Mangueira",
      "bairro": "Mangueira",
      "região": "Centro",
      "data": "11/02/17",
      "data relativa": "Sábado - 2 semanas antes do Carnaval",
      "concentração": "2017-02-11T16:00:00-02:00",
      "desfile": "2017-02-11T19:00:00-02:00",
      "final": "2017-02-11T22:00:00-02:00",
      "local da concentracao": "Campo da UPP Mangueira - Rua Visconde de Niterói",
      "percurso": "Rua Visconde de Niterói, do Campo da UPP até a quadra da Mangueira, voltando ao local de concentração",
      "público estimado": "2000",
      "ano do primeiro desfile": "2013"
    },
    {
      "bloco": "Amigos da Esquina",
      "bairro": "Engenho de Dentro",
      "região": "Zona Norte 2",
      "data": "11/02/17",
      "data relativa": "Sábado - 2 semanas antes do Carnaval",
      "concentração": "2017-02-11T16:00:00-02:00",
      "desfile": "2017-02-11T18:00:00-02:00",
      "final": "2017-02-11T22:00:00-02:00",
      "local da concentracao": "Rua Pernambuco com Rua 2 de Fevereiro e Rua Dr. Bulhões",
      "percurso": "Rua Pernambuco, Rua Barbacena, Rua Dr.Leal e Rua Pernambuco",
      "público estimado": "1000",
      "ano do primeiro desfile": "2004"
    },
    {
      "bloco": "Banda de Ipanema",
      "bairro": "Ipanema",
      "região": "Zona Sul",
      "data": "11/02/17",
      "data relativa": "Sábado - 2 semanas antes do Carnaval",
      "concentração": "2017-02-11T16:00:00-02:00",
      "desfile": "2017-02-11T17:30:00-02:00",
      "final": "2017-02-11T22:00:00-02:00",
      "local da concentracao": "Rua Jangadeiros, esquina com Gomes Carneiro",
      "percurso": "Rua Gomes Carneiro, Avenida Vieira Souto, Rua Joana Angélica e Rua Visconde de Pirajá, até a Praça General Osório",
      "público estimado": "50000",
      "ano do primeiro desfile": "1965"
    },
    {
      "bloco": "Calma Amor",
      "bairro": "Irajá",
      "região": "Zona Norte 1",
      "data": "11/02/17",
      "data relativa": "Sábado - 2 semanas antes do Carnaval",
      "concentração": "2017-02-11T16:00:00-02:00",
      "desfile": "2017-02-11T17:00:00-02:00",
      "final": "2017-02-11T22:00:00-02:00",
      "local da concentracao": "Praça Ferreira Souto",
      "percurso": "Praça Ferreira Souto - Parado",
      "público estimado": "2000",
      "ano do primeiro desfile": "2010"
    },
    {
      "bloco": "Deixa a Língua no Varal",
      "bairro": "Tijuca",
      "região": "Tijuca e Adj",
      "data": "11/02/17",
      "data relativa": "Sábado - 2 semanas antes do Carnaval",
      "concentração": "2017-02-11T16:00:00-02:00",
      "desfile": "2017-02-11T18:00:00-02:00",
      "final": "2017-02-11T20:00:00-02:00",
      "local da concentracao": "Rua Barão de Mesquita, 136",
      "percurso": "Rua Barão de Mesquita, Rua Deputado Soares Filho, Rua Pareto, Rua Almirante Cochrane, Rua Santo Afonso, Rua Pinto de Figueiredo, Av. Maracanã e Rua Barão de Mesquita",
      "público estimado": "1000",
      "ano do primeiro desfile": "2009"
    },
    {
      "bloco": "Encontro dos Blocos - Blocasso",
      "bairro": "Centro",
      "região": "Centro",
      "data": "11/02/17",
      "data relativa": "Sábado - 2 semanas antes do Carnaval",
      "concentração": "2017-02-11T16:00:00-02:00",
      "desfile": "2017-02-11T16:00:00-02:00",
      "final": "2017-02-11T22:00:00-02:00",
      "local da concentracao": "Praça Marechal Ancora",
      "percurso": "Parado",
      "público estimado": "3000",
      "ano do primeiro desfile": "2011"
    },
    {
      "bloco": "Nem Muda Nem Sai de Cima",
      "bairro": "Tijuca",
      "região": "Tijuca e Adj",
      "data": "11/02/17",
      "data relativa": "Sábado - 2 semanas antes do Carnaval",
      "concentração": "2017-02-11T16:00:00-02:00",
      "desfile": "2017-02-11T19:00:00-02:00",
      "final": "2017-02-11T22:00:00-02:00",
      "local da concentracao": "Rua Garibaldi, esquina com Avenida Maracanã",
      "percurso": "Rua Garibaldi, Rua Pinto Guedes, Praça Xavier de Brito, Rua Otávio Kelly, Rua Conde de Bonfim e Rua Garibaldi, voltando ao local de concentração",
      "público estimado": "3000",
      "ano do primeiro desfile": "1995"
    },
    {
      "bloco": "Paz e Amor",
      "bairro": "Paquetá",
      "região": "Centro",
      "data": "11/02/17",
      "data relativa": "Sábado - 2 semanas antes do Carnaval",
      "concentração": "2017-02-11T16:00:00-02:00",
      "desfile": "2017-02-11T17:00:00-02:00",
      "final": "2017-02-11T22:00:00-02:00",
      "local da concentracao": "Praça Pedro Bruno",
      "percurso": "Praia dos Tamoios, Cadeira do Vicente, Rua Principe Regente, Rua Dr Lacerda, Praia dos Tamoios, Praça Bom Jesus",
      "público estimado": "200",
      "ano do primeiro desfile": "2017"
    },
    {
      "bloco": "Vou Treinar e Volto Já",
      "bairro": "Tijuca",
      "região": "Tijuca e Adj",
      "data": "11/02/17",
      "data relativa": "Sábado - 2 semanas antes do Carnaval",
      "concentração": "2017-02-11T16:00:00-02:00",
      "desfile": "2017-02-11T17:00:00-02:00",
      "final": "2017-02-11T19:00:00-02:00",
      "local da concentracao": "Praça Afonso Pena",
      "percurso": "Rua Afonso Pena, Rua Haddock Lobo, Rua Campos Sales, Rua Martins Pena, até a esquina com Rua Afonso Pena",
      "público estimado": "1000",
      "ano do primeiro desfile": "2011"
    },
    {
      "bloco": "Panela Preta de Curicica",
      "bairro": "Curicica",
      "região": "Barra/JPA",
      "data": "11/02/17",
      "data relativa": "Sábado - 2 semanas antes do Carnaval",
      "concentração": "2017-02-11T17:00:00-02:00",
      "desfile": "2017-02-11T17:00:00-02:00",
      "final": "2017-02-11T22:00:00-02:00",
      "local da concentracao": "Rua João Bruno Lobo, no 38",
      "percurso": "Rua João Bruno Lobo, no 38 - Parado",
      "público estimado": "1500",
      "ano do primeiro desfile": "2011"
    },
    {
      "bloco": "Carmelitas (ENSAIO)",
      "bairro": "Centro",
      "região": "Centro",
      "data": "11/02/17",
      "data relativa": "Sabado - 2 semanas antes do Carnaval",
      "concentração": "2017-02-11T18:00:00-02:00",
      "desfile": "2017-02-11T18:00:00-02:00",
      "final": "2017-02-12T00:00:00-02:00",
      "local da concentracao": "Praça Tiradentes",
      "percurso": "PARADO",
      "público estimado": "2000",
      "ano do primeiro desfile": "1990"
    },
    {
      "bloco": "Cordão do Prata Preta",
      "bairro": "Gamboa",
      "região": "Centro",
      "data": "11/02/17",
      "data relativa": "Sábado - 2 semanas antes do Carnaval",
      "concentração": "2017-02-11T18:00:00-02:00",
      "desfile": "2017-02-11T18:00:00-02:00",
      "final": "2017-02-11T23:00:00-02:00",
      "local da concentracao": "Praça Coronel Assumpção (Praça da Harmonia)",
      "percurso": "Praça Coronel Assumpção (Praça da Harmonia) - Parado",
      "público estimado": "1000",
      "ano do primeiro desfile": "2005"
    },
    {
      "bloco": "Seu Kuka",
      "bairro": "Grajaú",
      "região": "Tijuca e Adj",
      "data": "11/02/17",
      "data relativa": "Sábado - 2 semanas antes do Carnaval",
      "concentração": "2017-02-11T15:00:00-02:00",
      "desfile": "2017-02-11T15:00:00-02:00",
      "final": "2017-02-11T21:00:00-02:00",
      "local da concentracao": "Rua Emilia Sampaio",
      "percurso": "Parado",
      "público estimado": "1000",
      "ano do primeiro desfile": "2007"
    },
    {
      "bloco": "Me Esquece",
      "bairro": "Jardim Botânico",
      "região": "Zona Sul",
      "data": "12/02/17",
      "data relativa": "Domingo - 2 semanas antes do Carnaval",
      "concentração": "2017-02-12T08:00:00-02:00",
      "desfile": "2017-02-12T09:00:00-02:00",
      "final": "2017-02-12T13:00:00-02:00",
      "local da concentracao": "Rua Jardim Botânico, esquina com Rua Pacheco Leão",
      "percurso": "Rua Jardim Botânico, da Rua Pacheco Leão até a Praça Santos Dumont",
      "público estimado": "15000",
      "ano do primeiro desfile": "2004"
    },
    {
      "bloco": "Volta, Alice",
      "bairro": "Laranjeiras",
      "região": "Zona Sul",
      "data": "12/02/17",
      "data relativa": "Domingo - 2 semanas antes do Carnaval",
      "concentração": "2017-02-12T08:00:00-02:00",
      "desfile": "2017-02-12T10:00:00-02:00",
      "final": "2017-02-12T13:00:00-02:00",
      "local da concentracao": "Rua Alice, no 1",
      "percurso": "Rua Alice, do no 1 ao no 550 - esquina com Mario Portela",
      "público estimado": "5000",
      "ano do primeiro desfile": "2005"
    },
    {
      "bloco": "Chame Gente (antigo Vira-Lata)",
      "bairro": "São Conrado",
      "região": "Zona Sul",
      "data": "12/02/17",
      "data relativa": "Domingo - 2 semanas antes do Carnaval",
      "concentração": "2017-02-12T09:00:00-02:00",
      "desfile": "2017-02-12T10:00:00-02:00",
      "final": "2017-02-12T15:00:00-02:00",
      "local da concentracao": "Av. Prefeito Mendes de Moraes, esquina com Rua Herbert Moses",
      "percurso": "Av. Prefeito Mendes de Moraes, da Rua Herbert Moses até a Rua Engenheiro Amandino de Carvalho (Muro do Gávea Golf)",
      "público estimado": "30000",
      "ano do primeiro desfile": "2007 (2017)"
    },
    {
      "bloco": "Alegria Sem Ressaca",
      "bairro": "Copacabana",
      "região": "Zona Sul",
      "data": "12/02/17",
      "data relativa": "Domingo - 2 semanas antes do Carnaval",
      "concentração": "2017-02-12T10:00:00-02:00",
      "desfile": "2017-02-12T10:00:00-02:00",
      "final": "2017-02-12T13:00:00-02:00",
      "local da concentracao": "Av. Atlântica, esquina com República do Perú",
      "percurso": "Av. Atlântica, esquina com República do Perú",
      "público estimado": "1000",
      "ano do primeiro desfile": "2002"
    },
    {
      "bloco": "Calma, Calma Sua Piranha",
      "bairro": "Botafogo",
      "região": "Zona Sul",
      "data": "12/02/17",
      "data relativa": "Domingo - 2 semanas antes do Carnaval",
      "concentração": "2017-02-12T10:00:00-02:00",
      "desfile": "2017-02-12T11:00:00-02:00",
      "final": "2017-02-12T16:00:00-02:00",
      "local da concentracao": "Rua Visconde de Caravelas, esquina com Rua Real Grandeza",
      "percurso": "Rua Visconde de Caravelas, da Rua Real Grandeza até a Rua Capitão Salomão",
      "público estimado": "3000",
      "ano do primeiro desfile": "2006"
    },
    {
      "bloco": "Foliões do Rio",
      "bairro": "Jardim Guanabara",
      "região": "Zona Norte 3",
      "data": "12/02/17",
      "data relativa": "Domingo - 2 semanas antes do Carnaval",
      "concentração": "2017-02-12T10:00:00-02:00",
      "desfile": "2017-02-12T12:00:00-02:00",
      "final": "2017-02-12T16:00:00-02:00",
      "local da concentracao": "Praça Jerusalém",
      "percurso": "Av. Alves Câmara Junior (Praia da Bica), da Praça Jerusalém até o no 819 (Quiosque 22)",
      "público estimado": "5000",
      "ano do primeiro desfile": ""
    },
    {
      "bloco": "Se Cair Eu Como",
      "bairro": "Ilha do Governador",
      "região": "Zona Norte 3",
      "data": "12/02/17",
      "data relativa": "Domingo - 2 semanas antes do Carnaval",
      "concentração": "2017-02-12T10:00:00-02:00",
      "desfile": "2017-02-12T12:00:00-02:00",
      "final": "2017-02-12T16:00:00-02:00",
      "local da concentracao": "Praça da Freguesia",
      "percurso": "Orla da Praia da Guanabara até a Praça do Bananal (Pedra da Onça)",
      "público estimado": "5000",
      "ano do primeiro desfile": "2012"
    },
    {
      "bloco": "Boi da Vila da Penha",
      "bairro": "Vila da Penha",
      "região": "Zona Norte 1",
      "data": "12/02/17",
      "data relativa": "Domingo - 2 semanas antes do Carnaval",
      "concentração": "2017-02-12T13:00:00-02:00",
      "desfile": "2017-02-12T16:00:00-02:00",
      "final": "2017-02-12T19:00:00-02:00",
      "local da concentracao": "Rua Ápia, no 890 a 900",
      "percurso": "Rua Ápia, Av. Brás de Pina, Rua Engenheiro Coriolano Góes, Rua Cacequi, Rua Frizia e Rua Ápia",
      "público estimado": "500",
      "ano do primeiro desfile": "2015"
    },
    {
      "bloco": "Beijo Quente",
      "bairro": "Fazenda Botafogo",
      "região": "Zona Norte 1",
      "data": "12/02/17",
      "data relativa": "Domingo - 2 semanas antes do Carnaval",
      "concentração": "2017-02-12T15:00:00-02:00",
      "desfile": "2017-02-12T17:00:00-02:00",
      "final": "2017-02-12T20:00:00-02:00",
      "local da concentracao": "Rua Pedro Jório",
      "percurso": "Rua Pedro Jório, Rua Vitor Frond, Rua Ouseley, Rua Prefeito Sá Lessa e Rua Pedro Jório",
      "público estimado": "500",
      "ano do primeiro desfile": "2014"
    },
    {
      "bloco": "Bigodinho Esticado",
      "bairro": "Méier",
      "região": "Zona Norte 2",
      "data": "12/02/17",
      "data relativa": "Domingo - 2 semanas antes do Carnaval",
      "concentração": "2017-02-12T15:00:00-02:00",
      "desfile": "2017-02-12T18:00:00-02:00",
      "final": "2017-02-12T21:00:00-02:00",
      "local da concentracao": "Rua Dias da Cruz, no 255",
      "percurso": "Rua Dias da Cruz, do no 255 até a Rua Hermengarda, voltando a concentração",
      "público estimado": "800",
      "ano do primeiro desfile": "2010"
    },
    {
      "bloco": "Malandragem do Porto",
      "bairro": "Saúde",
      "região": "Centro",
      "data": "12/02/17",
      "data relativa": "Domingo - 2 semanas antes do Carnaval",
      "concentração": "2017-02-12T15:00:00-02:00",
      "desfile": "2017-02-12T16:00:00-02:00",
      "final": "2017-02-12T21:00:00-02:00",
      "local da concentracao": "Tv Silvia Baião",
      "percurso": "PARADO",
      "público estimado": "500",
      "ano do primeiro desfile": "2016"
    },
    {
      "bloco": "Chinelo de Dedo",
      "bairro": "Centro",
      "região": "Centro",
      "data": "12/02/17",
      "data relativa": "Domingo - 2 semanas antes do Carnaval",
      "concentração": "2017-02-12T16:00:00-02:00",
      "desfile": "2017-02-12T17:00:00-02:00",
      "final": "2017-02-12T21:00:00-02:00",
      "local da concentracao": "Rua do Mercado 23",
      "percurso": "Parado",
      "público estimado": "500",
      "ano do primeiro desfile": "2015"
    },
    {
      "bloco": "Fiquei Firme da Favela",
      "bairro": "Saúde",
      "região": "Centro",
      "data": "12/02/17",
      "data relativa": "Domingo - 2 semanas antes do Carnaval",
      "concentração": "2017-02-12T16:00:00-02:00",
      "desfile": "2017-02-12T17:00:00-02:00",
      "final": "2017-02-12T22:00:00-02:00",
      "local da concentracao": "Praça Américo Brum",
      "percurso": "Praça Américo Brum, Ladeira do Barroso, Ladeira do Livramento, Rua Sacadura Cabral e Largo São Francisco da Prainha",
      "público estimado": "1000",
      "ano do primeiro desfile": "1978"
    },
    {
      "bloco": "Tira a Roupa Neném",
      "bairro": "Quintino",
      "região": "Zona Norte 1",
      "data": "12/02/17",
      "data relativa": "Domingo - 2 semanas antes do Carnaval",
      "concentração": "2017-02-12T16:00:00-02:00",
      "desfile": "2017-02-12T18:00:00-02:00",
      "final": "2017-02-12T22:00:00-02:00",
      "local da concentracao": "Rua Vital, esquina com Rua Nogueira",
      "percurso": "Parado",
      "público estimado": "3000",
      "ano do primeiro desfile": "2015"
    },
    {
      "bloco": "Xodó da Piedade",
      "bairro": "Piedade",
      "região": "Zona Norte 2",
      "data": "12/02/17",
      "data relativa": "Domingo - 2 semanas antes do Carnaval",
      "concentração": "2017-02-12T16:00:00-02:00",
      "desfile": "2017-02-12T18:00:00-02:00",
      "final": "2017-02-12T22:00:00-02:00",
      "local da concentracao": "Rua Silvana, esquina com Rua Mario Carpenter",
      "percurso": "Rua Silvana, Rua Mario Carpenter, Rua Leopoldina, Rua João Pinheiro, Av. Dom Helder Camara, Rua Ferreira Sampaio, Rua Ernesto Nunes, Rua Mario Carpenter e Rua Silvana",
      "público estimado": "1200",
      "ano do primeiro desfile": "1972"
    },
    {
      "bloco": "Império da Tijuca",
      "bairro": "Tijuca",
      "região": "Tijuca e Adj",
      "data": "12/02/17",
      "data relativa": "Domingo - 2 semanas antes do Carnaval",
      "concentração": "2017-02-12T19:00:00-02:00",
      "desfile": "2017-02-12T20:00:00-02:00",
      "final": "2017-02-12T22:00:00-02:00",
      "local da concentracao": "Rua Conde de Bonfim, esquina com Rua José Higino",
      "percurso": "Rua Conde de Bonfim, da Rua José Higino até a Rua Uruguai",
      "público estimado": "3000",
      "ano do primeiro desfile": "1940"
    },
    {
      "bloco": "Distribui Sem Juízo",
      "bairro": "Centro",
      "região": "Centro",
      "data": "16/02/17",
      "data relativa": "Quinta-feira - 1 semana antes do Carnaval",
      "concentração": "2017-02-16T17:00:00-02:00",
      "desfile": "2017-02-16T18:00:00-02:00",
      "final": "2017-02-16T19:00:00-02:00",
      "local da concentracao": "Rua da Quitanda entre Rua Sete de Setembro e Rua da Assembléia",
      "percurso": "PARADO",
      "público estimado": "100",
      "ano do primeiro desfile": "2017"
    },
    {
      "bloco": "Inova que eu Gosto",
      "bairro": "Flamengo",
      "região": "Zona Sul",
      "data": "16/02/17",
      "data relativa": "Quinta-feira 1 semanas antes do Carnaval",
      "concentração": "2017-02-16T17:00:00-02:00",
      "desfile": "2017-02-16T18:00:00-02:00",
      "final": "2017-02-16T22:00:00-02:00",
      "local da concentracao": "Rua Barão do Flamengo, esquina com Praia do Flamengo",
      "percurso": "Rua Barão do Flamengo, da esquina com Praia do Flamengo até a Rua Senador Vergueiro",
      "público estimado": "5000",
      "ano do primeiro desfile": "2008"
    },
    {
      "bloco": "Batuke Nuclear",
      "bairro": "Centro",
      "região": "Centro",
      "data": "16/02/17",
      "data relativa": "Quinta-feira - 1 semana antes do Carnaval",
      "concentração": "2017-02-16T18:00:00-02:00",
      "desfile": "2017-02-16T18:00:00-02:00",
      "final": "2017-02-16T23:00:00-02:00",
      "local da concentracao": "Rua da Candelária, 65, esquina com Teófilo Otoni",
      "percurso": "Rua da Candelária, 65, esquina com Teófilo Otoni - Parado",
      "público estimado": "1000",
      "ano do primeiro desfile": "2012"
    },
    {
      "bloco": "Ih, É Carnaval!",
      "bairro": "Urca",
      "região": "Zona Sul",
      "data": "17/02/17",
      "data relativa": "Sábado - 1 semana antes do Carnaval",
      "concentração": "2017-02-17T17:00:00-02:00",
      "desfile": "2017-02-17T19:00:00-02:00",
      "final": "2017-02-17T22:00:00-02:00",
      "local da concentracao": "Praça da Medalha Milhagrosa",
      "percurso": "Segue pela Av. Pasteur até altura do numero 250 onde dispersa.",
      "público estimado": "2000",
      "ano do primeiro desfile": "2002"
    },
    {
      "bloco": "Alegria do Méier",
      "bairro": "Méier",
      "região": "Zona Norte 2",
      "data": "17/02/17",
      "data relativa": "Sexta-feira - 1 semana antes do Carnaval",
      "concentração": "2017-02-17T18:00:00-02:00",
      "desfile": "2017-02-17T19:00:00-02:00",
      "final": "2017-02-17T23:00:00-02:00",
      "local da concentracao": "Rua Galdino Pimentel, esquina com Dias da Cruz",
      "percurso": "Parado",
      "público estimado": "1000",
      "ano do primeiro desfile": "2012"
    },
    {
      "bloco": "É o Bicho Folia",
      "bairro": "Irajá",
      "região": "Zona Norte 1",
      "data": "17/02/17",
      "data relativa": "Sexta-feira - 1 semana antes do Carnaval",
      "concentração": "2017-02-17T18:00:00-02:00",
      "desfile": "2017-02-17T19:00:00-02:00",
      "final": "2017-02-17T22:00:00-02:00",
      "local da concentracao": "Praça Rodrigues Galhardo",
      "percurso": "Praça Rodrigues Galhardo - Parado",
      "público estimado": "500",
      "ano do primeiro desfile": "2016"
    },
    {
      "bloco": "É Pequeno, mas vai Crescer",
      "bairro": "Centro",
      "região": "Centro",
      "data": "17/02/17",
      "data relativa": "Sexta-feira - 1 semana antes do Carnaval",
      "concentração": "2017-02-17T18:00:00-02:00",
      "desfile": "2017-02-17T19:00:00-02:00",
      "final": "2017-02-17T23:00:00-02:00",
      "local da concentracao": "Rua Alexandre Mackenzie,  esquina com Rua Senador Pompeu",
      "percurso": "Rua Alexandre Mackenzie,  esquina com Rua Senador Pompeu - Parado",
      "público estimado": "450",
      "ano do primeiro desfile": "2007"
    },
    {
      "bloco": "Molha o Pé das Oito",
      "bairro": "Centro",
      "região": "Centro",
      "data": "17/02/17",
      "data relativa": "Sexta-feira - 1 semana antes do Carnaval",
      "concentração": "2017-02-17T18:00:00-02:00",
      "desfile": "2017-02-17T20:00:00-02:00",
      "final": "2017-02-17T23:00:00-02:00",
      "local da concentracao": "Rua Rodrigo Silva, esquina com Rua São José",
      "percurso": "Rua Rodrigo Silva, Rua São José, Rua da Quitanda, Rua da Assembleia e Rua Rodrigo Silva",
      "público estimado": "500",
      "ano do primeiro desfile": "2010"
    },
    {
      "bloco": "Badalo de Santa Teresa",
      "bairro": "Santa Teresa",
      "região": "Centro",
      "data": "17/02/17",
      "data relativa": "Sexta-feira - 1 semana antes do Carnaval",
      "concentração": "2017-02-17T19:00:00-02:00",
      "desfile": "2017-02-17T20:00:00-02:00",
      "final": "2017-02-18T01:00:00-02:00",
      "local da concentracao": "Largo das Neves",
      "percurso": "Largo das Neves - Parado",
      "público estimado": "3000",
      "ano do primeiro desfile": "1972"
    },
    {
      "bloco": "Se Deixar Eu Boto",
      "bairro": "Pavuna",
      "região": "Zona Norte 1",
      "data": "17/02/17",
      "data relativa": "Sexta-feira - 1 semana antes do Carnaval",
      "concentração": "2017-02-17T19:00:00-02:00",
      "desfile": "2017-02-17T21:00:00-02:00",
      "final": "2017-02-17T23:00:00-02:00",
      "local da concentracao": "Rua Dr. José Thomás, no 920",
      "percurso": "Rua Dr. José Thomás, do no 920 ao no 435, voltando ao local de concentraçao",
      "público estimado": "1000",
      "ano do primeiro desfile": "2014"
    },
    {
      "bloco": "Céu na Terra",
      "bairro": "Santa Teresa",
      "região": "Centro",
      "data": "18/02/17",
      "data relativa": "Sábado - 1 semana antes do Carnaval",
      "concentração": "2017-02-18T07:00:00-02:00",
      "desfile": "2017-02-18T08:00:00-02:00",
      "final": "2017-02-18T11:00:00-02:00",
      "local da concentracao": "Largo dos Guimarães",
      "percurso": "Rua Pascoal Carlos Magno, Rua Monte Alegre, Rua Oriente, Rua Progresso, Largo das Neves",
      "público estimado": "5000",
      "ano do primeiro desfile": "2001"
    },
    {
      "bloco": "Bloco da Sá Pereira Infantil",
      "bairro": "Botafogo",
      "região": "Zona Sul",
      "data": "18/02/17",
      "data relativa": "Sábado - 1 semana antes do Carnaval",
      "concentração": "2017-02-18T08:00:00-02:00",
      "desfile": "2017-02-18T10:00:00-02:00",
      "final": "2017-02-18T13:00:00-02:00",
      "local da concentracao": "Rua Capistrano de Abreu, no 29",
      "percurso": "Rua Capistrano de Abreu, Rua Conde de Irajá, Largo dos Leões, Rua São Clemente, Rua Marques e Rua Capistrano de Abreu",
      "público estimado": "1000",
      "ano do primeiro desfile": "2009"
    },
    {
      "bloco": "Bloco dos Mendigos",
      "bairro": "Copacabana",
      "região": "Zona Sul",
      "data": "18/02/17",
      "data relativa": "Sábado - 1 semana antes do Carnaval",
      "concentração": "2017-02-18T08:00:00-02:00",
      "desfile": "2017-02-18T10:00:00-02:00",
      "final": "2017-02-18T14:00:00-02:00",
      "local da concentracao": "Rua Bulhões de Carvalho, esquina com Rainha Elizabeth",
      "percurso": "Rua Bulhões de Carvalho, Rua Rainha Elizabeth, Rua Teresa Aragão, Rua Gomes Carneiro e Rua Bulhões de Carvalho",
      "público estimado": "2000",
      "ano do primeiro desfile": "2005"
    },
    {
      "bloco": "Imaginô? Agora Amassa!",
      "bairro": "Leblon",
      "região": "Zona Sul",
      "data": "18/02/17",
      "data relativa": "Sábado - 1 semana antes do Carnaval",
      "concentração": "2017-02-18T08:00:00-02:00",
      "desfile": "2017-02-18T10:00:00-02:00",
      "final": "2017-02-18T14:00:00-02:00",
      "local da concentracao": "Rua José Linhares, esquina com Rua Conde de Bernadote",
      "percurso": "Rua José Linhares, Avenida Ataulfo de Paiva, seguindo até a esquina da Carlos Góis",
      "público estimado": "15000",
      "ano do primeiro desfile": "2003"
    },
    {
      "bloco": "Areia",
      "bairro": "Leblon",
      "região": "Zona Sul",
      "data": "18/02/17",
      "data relativa": "Sábado - 1 semana antes do Carnaval",
      "concentração": "2017-02-18T09:00:00-02:00",
      "desfile": "2017-02-18T11:00:00-02:00",
      "final": "2017-02-18T15:00:00-02:00",
      "local da concentracao": "Rua Dias Ferreira, entre a Avenida Bartolomeu Mitre e a Rua General Urquiza",
      "percurso": "Rua Dias Ferreira, entre a Avenida Bartolomeu Mitre e a Rua General Urquiza - Parado",
      "público estimado": "1500",
      "ano do primeiro desfile": "2003"
    },
    {
      "bloco": "Batuquebato",
      "bairro": "Maracanã",
      "região": "Tijuca e Adj",
      "data": "18/02/17",
      "data relativa": "Sábado - 1 semana antes do Carnaval",
      "concentração": "2017-02-18T09:00:00-02:00",
      "desfile": "2017-02-18T10:00:00-02:00",
      "final": "2017-02-18T14:00:00-02:00",
      "local da concentracao": "Avenida Radial Oeste, em frente ao Museu do Índio",
      "percurso": "Segue sempre pela calçada até a estátua do Belini e retorno a origem.",
      "público estimado": "600",
      "ano do primeiro desfile": "2016"
    },
    {
      "bloco": "Cordão de São José da Lagoa",
      "bairro": "Lagoa",
      "região": "Zona Sul",
      "data": "18/02/17",
      "data relativa": "Sábado - 1 semana antes do Carnaval",
      "concentração": "2017-02-18T09:00:00-02:00",
      "desfile": "2017-02-18T11:00:00-02:00",
      "final": "2017-02-18T13:00:00-02:00",
      "local da concentracao": "Av. Borges de Medeiros 2735 (Praça da Igreja de São José)",
      "percurso": "PARADO",
      "público estimado": "2000",
      "ano do primeiro desfile": "2017"
    },
    {
      "bloco": "Mini Bloco",
      "bairro": "Tijuca",
      "região": "Tijuca e Adj",
      "data": "18/02/17",
      "data relativa": "Sábado - 1 semana antes do Carnaval",
      "concentração": "2017-02-18T09:00:00-02:00",
      "desfile": "2017-02-18T09:00:00-02:00",
      "final": "2017-02-18T14:00:00-02:00",
      "local da concentracao": "Praça Xavier de Brito",
      "percurso": "Praça Xavier de Brito - Parado",
      "público estimado": "1000",
      "ano do primeiro desfile": "2013"
    },
    {
      "bloco": "Banda do Pechincha",
      "bairro": "Pechincha",
      "região": "Barra/JPA",
      "data": "18/02/17",
      "data relativa": "Sábado - 1 semana antes do Carnaval",
      "concentração": "2017-02-18T10:00:00-02:00",
      "desfile": "2017-02-18T12:00:00-02:00",
      "final": "2017-02-18T16:00:00-02:00",
      "local da concentracao": "Largo do Pechincha",
      "percurso": "Estrada do Pau Ferro, do no 16 ao no 240",
      "público estimado": "10000",
      "ano do primeiro desfile": "1996"
    },
    {
      "bloco": "Bloco D ́Samba",
      "bairro": "Barra da Tijuca",
      "região": "Barra/JPA",
      "data": "18/02/17",
      "data relativa": "Sábado - 1 semana antes do Carnaval",
      "concentração": "2017-02-18T10:00:00-02:00",
      "desfile": "2017-02-18T12:00:00-02:00",
      "final": "2017-02-18T16:00:00-02:00",
      "local da concentracao": "Av. do Pepê c/ Érico Veríssimo",
      "percurso": "Segue pela Av. do Pepê até altura da Rua Olegário Maciel",
      "público estimado": "20000",
      "ano do primeiro desfile": "2017"
    },
    {
      "bloco": "Bloco da Pracinha",
      "bairro": "Jardim Botânico",
      "região": "Zona Sul",
      "data": "18/02/17",
      "data relativa": "Sábado - 1 semana antes do Carnaval",
      "concentração": "2017-02-18T10:00:00-02:00",
      "desfile": "2017-02-18T12:00:00-02:00",
      "final": "2017-02-18T14:00:00-02:00",
      "local da concentracao": "Praca Pio XI",
      "percurso": "Praça Pio XI - Parado",
      "público estimado": "1000",
      "ano do primeiro desfile": "2006"
    },
    {
      "bloco": "Ilha Encosta que Ele Cresce",
      "bairro": "Jardim Guanabara",
      "região": "Zona Norte 3",
      "data": "18/02/17",
      "data relativa": "Sábado - 1 semana antes do Carnaval",
      "concentração": "2017-02-18T10:00:00-02:00",
      "desfile": "2017-02-18T12:00:00-02:00",
      "final": "2017-02-18T14:00:00-02:00",
      "local da concentracao": "Praça Jerusalém",
      "percurso": "Av. Alves Câmara Junior (Praia da Bica), da Praça Jerusalém até o no 1.191 (Farol da Ilha)",
      "público estimado": "10000",
      "ano do primeiro desfile": "2010"
    },
    {
      "bloco": "Parei de Beber, Não de Mentir!",
      "bairro": "Curicica",
      "região": "Barra/JPA",
      "data": "18/02/17",
      "data relativa": "Sábado - 1 semana antes do Carnaval",
      "concentração": "2017-02-18T10:00:00-02:00",
      "desfile": "2017-02-18T12:00:00-02:00",
      "final": "2017-02-18T16:00:00-02:00",
      "local da concentracao": "Praça do Bandolim",
      "percurso": "Praça do Bandolim - Parado",
      "público estimado": "5000",
      "ano do primeiro desfile": "2009"
    },
    {
      "bloco": "Só o Cume Interessa",
      "bairro": "Urca",
      "região": "Zona Sul",
      "data": "18/02/17",
      "data relativa": "Sábado - 1 semana antes do Carnaval",
      "concentração": "2017-02-18T10:00:00-02:00",
      "desfile": "2017-02-18T13:00:00-02:00",
      "final": "2017-02-18T16:00:00-02:00",
      "local da concentracao": "Praça General Tibúrcio",
      "percurso": "Praça General Tibúrcio",
      "público estimado": "600",
      "ano do primeiro desfile": "2005"
    },
    {
      "bloco": "Bloco da Urubuzada",
      "bairro": "Tijuca",
      "região": "Tijuca e Adj",
      "data": "18/02/17",
      "data relativa": "Sábado - 1 semana antes do Carnaval",
      "concentração": "2017-02-18T12:00:00-02:00",
      "desfile": "2017-02-18T14:00:00-02:00",
      "final": "2017-02-18T18:00:00-02:00",
      "local da concentracao": "Praça Afonso Pena",
      "percurso": "Praça Afonso Pena, Rua Campos Sales, Rua Mariz e Barros, Rua Ibituruna, Rua General Canabarro, Rua Mata Machado até o Estadio do Maracanã",
      "público estimado": "2000",
      "ano do primeiro desfile": "2008"
    },
    {
      "bloco": "Butano na Bureta",
      "bairro": "Maracanã",
      "região": "Tijuca e Adj",
      "data": "18/02/17",
      "data relativa": "Sábado - 1 semana antes do Carnaval",
      "concentração": "2017-02-18T12:00:00-02:00",
      "desfile": "2017-02-18T14:00:00-02:00",
      "final": "2017-02-18T18:00:00-02:00",
      "local da concentracao": "Rua Senador Furtado, esquina com Rua Pará",
      "percurso": "Rua Senador Furtado, da Rua Pará até a Avenida Radial Oeste, voltando pela Senador Furtado até a concentração",
      "público estimado": "1000",
      "ano do primeiro desfile": "2009"
    },
    {
      "bloco": "Plantão Bom é Samambaia",
      "bairro": "Maracanã",
      "região": "Tijuca e Adj",
      "data": "18/02/17",
      "data relativa": "Sábado - 1 semana antes do Carnaval",
      "concentração": "2017-02-18T12:00:00-02:00",
      "desfile": "2017-02-18T12:00:00-02:00",
      "final": "2017-02-18T18:00:00-02:00",
      "local da concentracao": "Praça Maracanã",
      "percurso": "Praça Maracanã - Parado",
      "público estimado": "400",
      "ano do primeiro desfile": "2011"
    },
    {
      "bloco": "Xupa Mas Não Baba",
      "bairro": "Laranjeiras",
      "região": "Zona Sul",
      "data": "18/02/17",
      "data relativa": "Sábado - 1 semana antes do Carnaval",
      "concentração": "2017-02-18T12:00:00-02:00",
      "desfile": "2017-02-18T14:00:00-02:00",
      "final": "2017-02-18T18:00:00-02:00",
      "local da concentracao": "Rua Alice, no 1",
      "percurso": "Rua Alice, do no 1 ao no 550 - esquina com Mario Portela",
      "público estimado": "4000",
      "ano do primeiro desfile": "1988"
    },
    {
      "bloco": "Alegria do Sapê",
      "bairro": "Rocha Miranda",
      "região": "Zona Norte 1",
      "data": "18/02/17",
      "data relativa": "Sábado - 1 semana antes do Carnaval",
      "concentração": "2017-02-18T13:00:00-02:00",
      "desfile": "2017-02-18T15:00:00-02:00",
      "final": "2017-02-18T19:00:00-02:00",
      "local da concentracao": "Rua Picui",
      "percurso": "Rua Picui até o Largo do Sapê e volta",
      "público estimado": "400",
      "ano do primeiro desfile": "2016"
    },
    {
      "bloco": "Vizinha Fofoqueira",
      "bairro": "Bento Ribeiro",
      "região": "Zona Norte 1",
      "data": "18/02/17",
      "data relativa": "Sábado - 1 semana antes do Carnaval",
      "concentração": "2017-02-18T13:00:00-02:00",
      "desfile": "2017-02-18T17:00:00-02:00",
      "final": "2017-02-18T18:00:00-02:00",
      "local da concentracao": "Rua Divinópolis, 167",
      "percurso": "Rua Divinópolis, seguindo pela Rua Picuí até a Carolina Machado",
      "público estimado": "1500",
      "ano do primeiro desfile": "2014"
    },
    {
      "bloco": "Bloco Brasil",
      "bairro": "Leme",
      "região": "Zona Sul",
      "data": "18/02/17",
      "data relativa": "Sábado - 1 semana antes do Carnaval",
      "concentração": "2017-02-18T14:00:00-02:00",
      "desfile": "2017-02-18T14:00:00-02:00",
      "final": "2017-02-18T20:00:00-02:00",
      "local da concentracao": "Praça Almirante Julio de Noronha",
      "percurso": "Praça Almirante Julio de Noronha - Parado",
      "público estimado": "25000",
      "ano do primeiro desfile": "2009"
    },
    {
      "bloco": "Bloco da Ansiedade",
      "bairro": "Laranjeiras",
      "região": "Zona Sul",
      "data": "18/02/17",
      "data relativa": "Sábado - 1 semana antes do Carnaval",
      "concentração": "2017-02-18T14:00:00-02:00",
      "desfile": "2017-02-18T16:00:00-02:00",
      "final": "2017-02-18T19:00:00-02:00",
      "local da concentracao": "Rua Gago Coutinho, em frente ao Mercadinho São José",
      "percurso": "Rua Gago Coutinho, Largo do Machado, Rua das Laranjeiras e Rua Gago Coutinho",
      "público estimado": "4000",
      "ano do primeiro desfile": "1995"
    },
    {
      "bloco": "Cachorrão Folia",
      "bairro": "Irajá",
      "região": "Zona Norte 1",
      "data": "18/02/17",
      "data relativa": "Sábado - 1 semana antes do Carnaval",
      "concentração": "2017-02-18T14:00:00-02:00",
      "desfile": "2017-02-18T16:00:00-02:00",
      "final": "2017-02-18T20:00:00-02:00",
      "local da concentracao": "Rua Manoel Araújo",
      "percurso": "Rua Manoel Araújo - Parado",
      "público estimado": "400",
      "ano do primeiro desfile": "2016"
    },
    {
      "bloco": "Eu Sou Normal, mas o Côco é Loko",
      "bairro": "Barra da Tijuca",
      "região": "Barra/JPA",
      "data": "18/02/17",
      "data relativa": "Sábado - 1 semana antes do Carnaval",
      "concentração": "2017-02-18T14:00:00-02:00",
      "desfile": "2017-02-18T14:00:00-02:00",
      "final": "2017-02-18T20:00:00-02:00",
      "local da concentracao": "Av. Lúcio Costa, em frente ao no 2.940 - Quiosque Côco Loko",
      "percurso": "Av. Lúcio Costa, em frente ao no 2.940 - Quiosque Côco Loko - Parado",
      "público estimado": "500",
      "ano do primeiro desfile": "2016"
    },
    {
      "bloco": "Fla Master",
      "bairro": "Barra da Tijuca",
      "região": "Barra/JPA",
      "data": "18/02/17",
      "data relativa": "Sábado - 1 semana antes do Carnaval",
      "concentração": "2017-02-18T14:00:00-02:00",
      "desfile": "2017-02-18T15:00:00-02:00",
      "final": "2017-02-18T20:00:00-02:00",
      "local da concentracao": "Avenida Lucio Costa, em frente ao no 3604 - Calçadão da praia",
      "percurso": "Avenida Lucio Costa, em frente ao no 3604 - Calçadão da praia",
      "público estimado": "500",
      "ano do primeiro desfile": "2016"
    },
    {
      "bloco": "Harmonia de Copacabana",
      "bairro": "Copacabana",
      "região": "Zona Sul",
      "data": "18/02/17",
      "data relativa": "Sábado - 1 semana antes do Carnaval",
      "concentração": "2017-02-18T14:00:00-02:00",
      "desfile": "2017-02-18T18:00:00-02:00",
      "final": "2017-02-18T20:00:00-02:00",
      "local da concentracao": "Avenida Atlântica, esquina com Siqueira Campos",
      "percurso": "Avenida Atlântica, da Siqueira Campos PARADO",
      "público estimado": "2000",
      "ano do primeiro desfile": "2010"
    },
    {
      "bloco": "Me Engana Que Eu Gosto",
      "bairro": "Botafogo",
      "região": "Zona Sul",
      "data": "18/02/17",
      "data relativa": "Sábado - 1 semana antes do Carnaval",
      "concentração": "2017-02-18T14:00:00-02:00",
      "desfile": "2017-02-18T16:00:00-02:00",
      "final": "2017-02-18T21:00:00-02:00",
      "local da concentracao": "Praça Jóia Valansi",
      "percurso": "Parado",
      "público estimado": "150",
      "ano do primeiro desfile": "1985"
    },
    {
      "bloco": "Põe na Quentinha?",
      "bairro": "Centro",
      "região": "Centro",
      "data": "18/02/17",
      "data relativa": "Sábado - 1 semana antes do Carnaval",
      "concentração": "2017-02-18T14:00:00-02:00",
      "desfile": "2017-02-18T15:00:00-02:00",
      "final": "2017-02-18T20:00:00-02:00",
      "local da concentracao": "Rua Conselheiro Saraiva, em frente ao no 39",
      "percurso": "Rua Conselheiro Saraiva, em frente ao no 39 - Parado",
      "público estimado": "1500",
      "ano do primeiro desfile": "2015"
    },
    {
      "bloco": "Simpatia é Quase Amor",
      "bairro": "Ipanema",
      "região": "Zona Sul",
      "data": "18/02/17",
      "data relativa": "Sábado - 1 semana antes do Carnaval",
      "concentração": "2017-02-18T14:00:00-02:00",
      "desfile": "2017-02-18T16:00:00-02:00",
      "final": "2017-02-18T20:00:00-02:00",
      "local da concentracao": "Praça General Osório",
      "percurso": "Rua Teixeira de Melo e Avenida Vieira Souto até a Henrique Dumont",
      "público estimado": "100000",
      "ano do primeiro desfile": "1985"
    },
    {
      "bloco": "Batuke de Ciata",
      "bairro": "Saúde",
      "região": "Centro",
      "data": "18/02/17",
      "data relativa": "Sábado - 1 semana antes do Carnaval",
      "concentração": "2017-02-18T15:00:00-02:00",
      "desfile": "2017-02-18T16:00:00-02:00",
      "final": "2017-02-18T21:00:00-02:00",
      "local da concentracao": "Praça Coronel Assunção (Praça da Harmonia)",
      "percurso": "Rua Sacadura Cabral, da Praça da Harmonia até a Rua Argemiro Bulcão, encerrando na Pedra do Sal",
      "público estimado": "500",
      "ano do primeiro desfile": "2016"
    },
    {
      "bloco": "É Pequeno mas não amolece",
      "bairro": "Recreio",
      "região": "Barra/JPA",
      "data": "18/02/17",
      "data relativa": "Sábado - 1 semana antes do Carnaval",
      "concentração": "2017-02-18T15:00:00-02:00",
      "desfile": "2017-02-18T17:00:00-02:00",
      "final": "2017-02-18T21:00:00-02:00",
      "local da concentracao": "Praça Professor Henrique Niremberg",
      "percurso": "Parado",
      "público estimado": "500",
      "ano do primeiro desfile": "2009"
    },
    {
      "bloco": "Embalo da Barão",
      "bairro": "Praça Seca",
      "região": "Barra/JPA",
      "data": "18/02/17",
      "data relativa": "Sábado - 1 semana antes do Carnaval",
      "concentração": "2017-02-18T15:00:00-02:00",
      "desfile": "2017-02-18T16:00:00-02:00",
      "final": "2017-02-18T21:00:00-02:00",
      "local da concentracao": "Country Clube da Praça Seca",
      "percurso": "Country Clube da Praça Seca",
      "público estimado": "800",
      "ano do primeiro desfile": "2003"
    },
    {
      "bloco": "Lavou Tá Limpo",
      "bairro": "Praça Seca",
      "região": "Barra/JPA",
      "data": "18/02/17",
      "data relativa": "Sábado - 1 semana antes do Carnaval",
      "concentração": "2017-02-18T15:00:00-02:00",
      "desfile": "2017-02-18T16:00:00-02:00",
      "final": "2017-02-18T18:00:00-02:00",
      "local da concentracao": "Rua Candido Benício, 2235",
      "percurso": "Rua Florianópolis, entre Candido Benício e Rua Desembargador Gastão Taveira - Parado",
      "público estimado": "800",
      "ano do primeiro desfile": "2000"
    },
    {
      "bloco": "Os Imóveis",
      "bairro": "Copacabana",
      "região": "Zona Sul",
      "data": "18/02/17",
      "data relativa": "Sábado - 1 semana antes do Carnaval",
      "concentração": "2017-02-18T15:00:00-02:00",
      "desfile": "2017-02-18T15:00:00-02:00",
      "final": "2017-02-18T20:00:00-02:00",
      "local da concentracao": "Rua Souza Lima, em frente ao no 121",
      "percurso": "Rua Souza Lima, em frente ao no 121 - Parado",
      "público estimado": "200",
      "ano do primeiro desfile": "2006"
    },
    {
      "bloco": "Os Monarcas",
      "bairro": "Ribeira",
      "região": "Zona Norte 3",
      "data": "18/02/17",
      "data relativa": "Sábado - 1 semana antes do Carnaval",
      "concentração": "2017-02-18T15:00:00-02:00",
      "desfile": "2017-02-18T17:00:00-02:00",
      "final": "2017-02-18T21:00:00-02:00",
      "local da concentracao": "Praia da Engenhoca (Quiosque 5)",
      "percurso": "Praia da Engenhoca (Quiosque 5) - parado",
      "público estimado": "4000",
      "ano do primeiro desfile": "2009"
    },
    {
      "bloco": "Pinto Sarado",
      "bairro": "Santo Cristo",
      "região": "Centro",
      "data": "18/02/17",
      "data relativa": "Sábado - 1 semana antes do Carnaval",
      "concentração": "2017-02-18T15:00:00-02:00",
      "desfile": "2017-02-18T17:00:00-02:00",
      "final": "2017-02-18T20:00:00-02:00",
      "local da concentracao": "Travessa Sara",
      "percurso": "Travessa Sara, Rua Atilia, Rua Orestes, Rua Sara, Rua Santo Cristo, Rua da América e Rua Barão da Gamboa.",
      "público estimado": "3500",
      "ano do primeiro desfile": "2008"
    },
    {
      "bloco": "Rio Pandeiro",
      "bairro": "Laranjeiras",
      "região": "Zona Sul",
      "data": "18/02/17",
      "data relativa": "Sábado - 1 semana antes do Carnaval",
      "concentração": "2017-02-18T15:00:00-02:00",
      "desfile": "2017-02-18T16:00:00-02:00",
      "final": "2017-02-18T20:00:00-02:00",
      "local da concentracao": "Praça São Salvador",
      "percurso": "Praça São Salvador - Parado",
      "público estimado": "1500",
      "ano do primeiro desfile": "2010"
    },
    {
      "bloco": "Alegria da Mangueira",
      "bairro": "Mangueira",
      "região": "Centro",
      "data": "18/02/17",
      "data relativa": "Sábado - 1 semana antes do Carnaval",
      "concentração": "2017-02-18T16:00:00-02:00",
      "desfile": "2017-02-18T19:00:00-02:00",
      "final": "2017-02-18T22:00:00-02:00",
      "local da concentracao": "Campo da UPP Mangueira - Rua Visconde de Niterói",
      "percurso": "Rua Visconde de Niterói, do Campo da UPP até a quadra da Mangueira, voltando ao local de concentração",
      "público estimado": "2000",
      "ano do primeiro desfile": "2013"
    },
    {
      "bloco": "Amigos da Esquina",
      "bairro": "Engenho de Dentro",
      "região": "Zona Norte 2",
      "data": "18/02/17",
      "data relativa": "Sábado - 1 semana antes do Carnaval",
      "concentração": "2017-02-18T16:00:00-02:00",
      "desfile": "2017-02-18T18:00:00-02:00",
      "final": "2017-02-18T22:00:00-02:00",
      "local da concentracao": "Rua 2 de fevereiro, esquina com Rua Pernambuco e Rua Dr. Bulhões",
      "percurso": "Rua Pernambuco, Rua Barbacena, Rua Dr.Leal e Rua Pernambuco",
      "público estimado": "1000",
      "ano do primeiro desfile": "2004"
    },
    {
      "bloco": "Amigos do Catete",
      "bairro": "Catete",
      "região": "Zona Sul",
      "data": "18/02/17",
      "data relativa": "Sábado - 1 semana antes do Carnaval",
      "concentração": "2017-02-18T16:00:00-02:00",
      "desfile": "2017-02-18T18:00:00-02:00",
      "final": "2017-02-18T22:00:00-02:00",
      "local da concentracao": "Rua Dois de Dezembro, esquina com Rua do Catete",
      "percurso": "Rua Dois de Dezembro, esquina com Rua do Catete - Parado",
      "público estimado": "700",
      "ano do primeiro desfile": "2002"
    },
    {
      "bloco": "ASPA - Amigos da Sueca da Pedro Américo",
      "bairro": "Catete",
      "região": "Zona Sul",
      "data": "18/02/17",
      "data relativa": "Sábado - 1 semana antes do Carnaval",
      "concentração": "2017-02-18T16:00:00-02:00",
      "desfile": "2017-02-18T18:00:00-02:00",
      "final": "2017-02-18T21:00:00-02:00",
      "local da concentracao": "Rua Pedro Américo, no 363",
      "percurso": "Rua Pedro Américo, no 363 - Parado",
      "público estimado": "1000",
      "ano do primeiro desfile": "2010"
    },
    {
      "bloco": "Banda Bandida",
      "bairro": "Copacabana",
      "região": "Zona Sul",
      "data": "18/02/17",
      "data relativa": "Sábado - 1 semana antes do Carnaval",
      "concentração": "2017-02-18T16:00:00-02:00",
      "desfile": "2017-02-18T18:00:00-02:00",
      "final": "2017-02-18T22:00:00-02:00",
      "local da concentracao": "Rua Rodolfo Dantas, entre a Av. Nossa Senhora Copacabana e Rua Barata Ribeiro",
      "percurso": "Rua Rodolfo Dantas, Rua Barata Ribeiro, Rua Iangá, Avenida Nossa Senhora de Copacabana e Rua Rodolfo Dantas",
      "público estimado": "3000",
      "ano do primeiro desfile": "1976"
    },
    {
      "bloco": "Banda do Tijuca Tênis Clube",
      "bairro": "Tijuca",
      "região": "Tijuca e Adj",
      "data": "18/02/17",
      "data relativa": "Sábado - 1 semana antes do Carnaval",
      "concentração": "2017-02-18T16:00:00-02:00",
      "desfile": "2017-02-18T18:00:00-02:00",
      "final": "2017-02-18T21:00:00-02:00",
      "local da concentracao": "Tijuca Tênis Clube",
      "percurso": "Rua Abelardo Chacrinha Barbosa, Rua Conde de Bonfim, Rua Pareto, Rua Santo Afonso, Rua Major Ávila, Rua Conde de Bonfim e Tijuca Tênis Clube",
      "público estimado": "1200",
      "ano do primeiro desfile": "1984"
    },
    {
      "bloco": "Banda do Village",
      "bairro": "Portuguesa",
      "região": "Zona Norte 3",
      "data": "18/02/17",
      "data relativa": "Sábado - 1 semana antes do Carnaval",
      "concentração": "2017-02-18T16:00:00-02:00",
      "desfile": "2017-02-18T16:00:00-02:00",
      "final": "2017-02-18T22:00:00-02:00",
      "local da concentracao": "Rua Luiz Sá, altura do número 205",
      "percurso": "Rua Luiz de Sá, Rua Fernando de Azevedo e retorno a origem.",
      "público estimado": "2000",
      "ano do primeiro desfile": "2007"
    },
    {
      "bloco": "Banda Haddock",
      "bairro": "Tijuca",
      "região": "Tijuca e Adj",
      "data": "18/02/17",
      "data relativa": "Sábado - 1 semana antes do Carnaval",
      "concentração": "2017-02-18T16:00:00-02:00",
      "desfile": "2017-02-18T18:00:00-02:00",
      "final": "2017-02-18T22:00:00-02:00",
      "local da concentracao": "Rua Afonso Pena, no 10",
      "percurso": "Rua Afonso Pena, Rua Haddock Lobo, Rua Campos Sales, Doutor Satamini, São Francisco Xavier, Largo da Segunda-feira, Rua Haddock Lobo e Rua Afonso Pena",
      "público estimado": "8000",
      "ano do primeiro desfile": "1984"
    },
    {
      "bloco": "Bloco da Mamadeira",
      "bairro": "Botafogo",
      "região": "Zona Sul",
      "data": "18/02/17",
      "data relativa": "Sábado - 1 semana antes do Carnaval",
      "concentração": "2017-02-18T16:00:00-02:00",
      "desfile": "2017-02-18T16:00:00-02:00",
      "final": "2017-02-18T19:00:00-02:00",
      "local da concentracao": "Praça General Leandro",
      "percurso": "Praça General Leandro - Parado",
      "público estimado": "500",
      "ano do primeiro desfile": "2000"
    },
    {
      "bloco": "Bloco do Ipê",
      "bairro": "Tijuca",
      "região": "Tijuca e Adj",
      "data": "18/02/17",
      "data relativa": "Sábado - 1 semana antes do Carnaval",
      "concentração": "2017-02-18T16:00:00-02:00",
      "desfile": "2017-02-18T17:00:00-02:00",
      "final": "2017-02-18T18:00:00-02:00",
      "local da concentracao": "Rua Alm. Cochrane 36",
      "percurso": "Vira na Rua Dulce até a Rua São Francisco Xavier retornando a origem.",
      "público estimado": "150",
      "ano do primeiro desfile": "2017 (2008)"
    },
    {
      "bloco": "Boca Aberta",
      "bairro": "Maré",
      "região": "Zona Norte 2",
      "data": "18/02/17",
      "data relativa": "Sábado - 1 semana antes do Carnaval",
      "concentração": "2017-02-18T16:00:00-02:00",
      "desfile": "2017-02-18T19:00:00-02:00",
      "final": "2017-02-18T22:00:00-02:00",
      "local da concentracao": "Rua Tancredo Neves",
      "percurso": "Rua Tancredo Neves, Bitencourt Sampaio, Rua Principal e Rua Tancredo Neves",
      "público estimado": "400",
      "ano do primeiro desfile": "2014"
    },
    {
      "bloco": "Calma Amor",
      "bairro": "Irajá",
      "região": "Zona Norte 1",
      "data": "18/02/17",
      "data relativa": "Sábado - 1 semana antes do Carnaval",
      "concentração": "2017-02-18T16:00:00-02:00",
      "desfile": "2017-02-18T17:00:00-02:00",
      "final": "2017-02-18T22:00:00-02:00",
      "local da concentracao": "Praça Ferreira Souto",
      "percurso": "Praça Ferreira Souto - Parado",
      "público estimado": "2000",
      "ano do primeiro desfile": "2010"
    },
    {
      "bloco": "Cê Tá Lindo",
      "bairro": "Taquara",
      "região": "Barra/JPA",
      "data": "18/02/17",
      "data relativa": "Sábado - 1 semana antes do Carnaval",
      "concentração": "2017-02-18T16:00:00-02:00",
      "desfile": "2017-02-18T16:00:00-02:00",
      "final": "2017-02-18T20:00:00-02:00",
      "local da concentracao": "Rua Meringuava, no 401",
      "percurso": "Parado",
      "público estimado": "500",
      "ano do primeiro desfile": "2016"
    },
    {
      "bloco": "Cutucano Atrás",
      "bairro": "Leme",
      "região": "Zona Sul",
      "data": "18/02/17",
      "data relativa": "Sábado - 1 semana antes do Carnaval",
      "concentração": "2017-02-18T16:00:00-02:00",
      "desfile": "2017-02-18T18:00:00-02:00",
      "final": "2017-02-18T22:00:00-02:00",
      "local da concentracao": "Avenida Atlântica, altura do no 458 - Quiosque Estrela de Luz - Calçadão",
      "percurso": "Avenida Atlântica, altura do no 458 - atravessa do calçadão até a os prédios e volta ao local de concentração",
      "público estimado": "1000",
      "ano do primeiro desfile": "2004"
    },
    {
      "bloco": "Encosta que Ele Cresce",
      "bairro": "Vista Alegre",
      "região": "Zona Norte 1",
      "data": "18/02/17",
      "data relativa": "Sábado - 1 semana antes do Carnaval",
      "concentração": "2017-02-18T16:00:00-02:00",
      "desfile": "2017-02-18T17:00:00-02:00",
      "final": "2017-02-18T21:00:00-02:00",
      "local da concentracao": "Rua Ribadejo",
      "percurso": "Rua Ribadejo, Estrada da Água Grande (sentido Irajá), seguindo até a Avenida Brás de Pina, retornando pela Estrada da Água Grande (sentido Cordovil) até a Rua Estremadura",
      "público estimado": "1000",
      "ano do primeiro desfile": "2006"
    },
    {
      "bloco": "Eu Não Venho Mais Aqui",
      "bairro": "Abolição",
      "região": "Zona Norte 1",
      "data": "18/02/17",
      "data relativa": "Sábado - 1 semana antes do Carnaval",
      "concentração": "2017-02-18T16:00:00-02:00",
      "desfile": "2017-02-18T18:00:00-02:00",
      "final": "2017-02-18T22:00:00-02:00",
      "local da concentracao": "Rua Gaspar, esquina com Rua Ferreira Leite",
      "percurso": "Rua Ferreira Leite, da Rua Gaspar até a Rua Glaziou, retornando ao local de concentração",
      "público estimado": "500",
      "ano do primeiro desfile": "2011"
    },
    {
      "bloco": "Fuzuê... Só Alegria Pra Você!",
      "bairro": "Del Castilho",
      "região": "Zona Norte 2",
      "data": "18/02/17",
      "data relativa": "Sábado - 1 semana antes do Carnaval",
      "concentração": "2017-02-18T16:00:00-02:00",
      "desfile": "2017-02-18T18:00:00-02:00",
      "final": "2017-02-18T22:00:00-02:00",
      "local da concentracao": "Rua Chapadinha, no 02",
      "percurso": "Rua Chapadinha, Rua Lagoa Verde, Rua Lagoa Clara, Rua Lagoa Redonda, Rua Chapadinha e Rua Palmeira do Norte",
      "público estimado": "1500",
      "ano do primeiro desfile": "2004"
    },
    {
      "bloco": "Guri da Merck",
      "bairro": "Taquara",
      "região": "Barra/JPA",
      "data": "18/02/17",
      "data relativa": "Sábado - 1 semana antes do Carnaval",
      "concentração": "2017-02-18T16:00:00-02:00",
      "desfile": "2017-02-18T19:00:00-02:00",
      "final": "2017-02-18T22:00:00-02:00",
      "local da concentracao": "Praça Albert Sabin (Praça da Merck)",
      "percurso": "Praça da Merck, Rua José Perigaut, Rua frei Luiz Alevato, Rua Aristóteles de Souza Dantas, Rua Carlos Palut, Rua José Perigaut e Praça da Merck",
      "público estimado": "1000",
      "ano do primeiro desfile": "2013"
    },
    {
      "bloco": "Já Comi Pior Pagando",
      "bairro": "Tijuca",
      "região": "Tijuca e Adj",
      "data": "18/02/17",
      "data relativa": "Sábado - 1 semana antes do Carnaval",
      "concentração": "2017-02-18T16:00:00-02:00",
      "desfile": "2017-02-18T16:00:00-02:00",
      "final": "2017-02-18T22:00:00-02:00",
      "local da concentracao": "Rua Leite de Abreu",
      "percurso": "PARADO",
      "público estimado": "1000",
      "ano do primeiro desfile": "2010"
    },
    {
      "bloco": "Mistura de Santa",
      "bairro": "Santa Teresa",
      "região": "Centro",
      "data": "18/02/17",
      "data relativa": "Sábado - 1 semana antes do Carnaval",
      "concentração": "2017-02-18T16:00:00-02:00",
      "desfile": "2017-02-18T18:00:00-02:00",
      "final": "2017-02-18T21:00:00-02:00",
      "local da concentracao": "Mirante do Rato Molhado",
      "percurso": "Segue pela Rua Aprazível até dispersar na lateral do Castelo São Valentimna parte alta da Rua Almirante Alexandrino.",
      "público estimado": "1000",
      "ano do primeiro desfile": "2014"
    },
    {
      "bloco": "Pérola da Guanabara",
      "bairro": "Paquetá",
      "região": "Centro",
      "data": "18/02/17",
      "data relativa": "Sábado - 1 semana antes do Carnaval",
      "concentração": "2017-02-18T16:00:00-02:00",
      "desfile": "2017-02-18T18:00:00-02:00",
      "final": "2017-02-18T21:00:00-02:00",
      "local da concentracao": "Praça São Roque",
      "percurso": "Parado",
      "público estimado": "1000",
      "ano do primeiro desfile": "2011"
    },
    {
      "bloco": "Afoxé Omo Ifá",
      "bairro": "Tijuca",
      "região": "Tijuca e Adj",
      "data": "18/02/17",
      "data relativa": "Sábado - 1 semana antes do Carnaval",
      "concentração": "2017-02-18T17:00:00-02:00",
      "desfile": "2017-02-18T18:00:00-02:00",
      "final": "2017-02-18T21:00:00-02:00",
      "local da concentracao": "Praça Barão de Drummond",
      "percurso": "Praça Barão de Drummond - Parado",
      "público estimado": "200",
      "ano do primeiro desfile": "2013"
    },
    {
      "bloco": "Banda da Flack",
      "bairro": "Riachuelo",
      "região": "Zona Norte 2",
      "data": "18/02/17",
      "data relativa": "Sábado - 1 semana antes do Carnaval",
      "concentração": "2017-02-18T17:00:00-02:00",
      "desfile": "2017-02-18T19:00:00-02:00",
      "final": "2017-02-18T23:00:00-02:00",
      "local da concentracao": "Rua Flack",
      "percurso": "Rua Flack, Rua Lino Teixeira, Rua Ana Neri, Rua Magalhães de Castro e Rua Flack",
      "público estimado": "300",
      "ano do primeiro desfile": "2008"
    },
    {
      "bloco": "Bloco do Rock",
      "bairro": "Centro",
      "região": "Centro",
      "data": "18/02/17",
      "data relativa": "Sábado - 1 semana antes do Carnaval",
      "concentração": "2017-02-18T17:00:00-02:00",
      "desfile": "2017-02-18T18:30:00-02:00",
      "final": "2017-02-18T21:00:00-02:00",
      "local da concentracao": "Praça Tiradentes",
      "percurso": "Praça Tiradentes (Parado)",
      "público estimado": "2000",
      "ano do primeiro desfile": "2012"
    },
    {
      "bloco": "Eu Amo a Lapa",
      "bairro": "Lapa",
      "região": "Centro",
      "data": "18/02/17",
      "data relativa": "Sábado - 1 semana antes do Carnaval",
      "concentração": "2017-02-18T17:00:00-02:00",
      "desfile": "2017-02-18T19:00:00-02:00",
      "final": "2017-02-18T23:00:00-02:00",
      "local da concentracao": "Praça Cardeal Câmara (Arcos da Lapa)",
      "percurso": "Praça Cardeal Câmara (Arcos da Lapa) - Parado",
      "público estimado": "1000",
      "ano do primeiro desfile": "2007"
    },
    {
      "bloco": "Morde e Pica Toda Hora",
      "bairro": "Jacarepaguá",
      "região": "Barra/JPA",
      "data": "18/02/17",
      "data relativa": "Sábado - 1 semana antes do Carnaval",
      "concentração": "2017-02-18T17:00:00-02:00",
      "desfile": "2017-02-18T18:00:00-02:00",
      "final": "2017-02-18T22:00:00-02:00",
      "local da concentracao": "Rua Jorge Faraj",
      "percurso": "Rua Jorge Faraj - Parado",
      "público estimado": "300",
      "ano do primeiro desfile": "2012"
    },
    {
      "bloco": "Serrote Afiado",
      "bairro": "Engenho da Rainha",
      "região": "Zona Norte 2",
      "data": "18/02/17",
      "data relativa": "Sábado - 1 semana antes do Carnaval",
      "concentração": "2017-02-18T17:00:00-02:00",
      "desfile": "2017-02-18T17:00:00-02:00",
      "final": "2017-02-18T23:00:00-02:00",
      "local da concentracao": "Rua Mario ferreira, 217",
      "percurso": "Rua Mario Ferreira, Rua Ferreira de Menezes, Rua Carlos Gonçalves Pena e Rua Mario Ferreira",
      "público estimado": "1500",
      "ano do primeiro desfile": "2004"
    },
    {
      "bloco": "Carmelitas (ENSAIO)",
      "bairro": "Centro",
      "região": "Centro",
      "data": "18/02/17",
      "data relativa": "Sabado - 1 semana antes do Carnaval",
      "concentração": "2017-02-18T18:00:00-02:00",
      "desfile": "2017-02-18T18:00:00-02:00",
      "final": "2017-02-19T00:00:00-03:00",
      "local da concentracao": "Praça Tiradentes",
      "percurso": "PARADO",
      "público estimado": "2000",
      "ano do primeiro desfile": "1990"
    },
    {
      "bloco": "Você Vem Se Quiser",
      "bairro": "Centro",
      "região": "Centro",
      "data": "18/02/17",
      "data relativa": "Sábado - 1 semana antes do Carnaval",
      "concentração": "2017-02-18T18:00:00-02:00",
      "desfile": "2017-02-18T18:00:00-02:00",
      "final": "2017-02-19T00:00:00-03:00",
      "local da concentracao": "ABI - Rua Araújo Porto Alegre 71",
      "percurso": "Parado",
      "público estimado": "1000",
      "ano do primeiro desfile": "2017"
    },
    {
      "bloco": "Seu Kuka",
      "bairro": "Grajaú",
      "região": "Tijuca e Adj",
      "data": "18/02/17",
      "data relativa": "Sábado - 1 semana antes do Carnaval",
      "concentração": "2017-02-18T15:00:00-02:00",
      "desfile": "2017-02-18T15:00:00-02:00",
      "final": "2017-02-18T21:00:00-02:00",
      "local da concentracao": "Rua Emilia Sampaio",
      "percurso": "Parado",
      "público estimado": "1000",
      "ano do primeiro desfile": "2007"
    },
    {
      "bloco": "Cordão do Boitatá (Cortejo)",
      "bairro": "Centro",
      "região": "Centro",
      "data": "19/02/17",
      "data relativa": "Domingo - 1 semana antes do Carnaval",
      "concentração": "2017-02-19T07:00:00-03:00",
      "desfile": "2017-02-19T09:00:00-03:00",
      "final": "2017-02-19T13:00:00-03:00",
      "local da concentracao": "Arcos da Lapa",
      "percurso": "Arcos da Lapa, Rua dos Arcos, Rua do Rezende, Rua Gomes Freire, Rua da Relação, Rua do Lavradio, Rua Pedro I, seguindo até a Praça Tiradentes",
      "público estimado": "5000",
      "ano do primeiro desfile": "1997"
    },
    {
      "bloco": "Banda de Cavalcante",
      "bairro": "Cavalcante",
      "região": "Zona Norte 2",
      "data": "19/02/17",
      "data relativa": "Domingo - 1 semana antes do Carnaval",
      "concentração": "2017-02-19T08:00:00-03:00",
      "desfile": "2017-02-19T10:00:00-03:00",
      "final": "2017-02-19T14:00:00-03:00",
      "local da concentracao": "Rua Graça Melo, em frente ao no 640",
      "percurso": "Rua Graça Melo, Rua Padre Manuel da Nóbrega, Rua Amparo, Rua Frei Antônio, Rua Barão do Bananal e Rua Múcio Teixeira",
      "público estimado": "1500",
      "ano do primeiro desfile": "2000"
    },
    {
      "bloco": "Blocão de Copacabana",
      "bairro": "Copacabana",
      "região": "Zona Sul",
      "data": "19/02/17",
      "data relativa": "Domingo - 1 semana antes do Carnaval",
      "concentração": "2017-02-19T08:00:00-03:00",
      "desfile": "2017-02-19T09:00:00-03:00",
      "final": "2017-02-19T11:00:00-03:00",
      "local da concentracao": "Posto 6 de Copacabana (Sofitel)",
      "percurso": "Com deslocamento até a Rua Xavier da Silveira.",
      "público estimado": "800",
      "ano do primeiro desfile": "2001"
    },
    {
      "bloco": "Bloco da Preta",
      "bairro": "Centro",
      "região": "Centro",
      "data": "19/02/17",
      "data relativa": "Domingo - 1 semana antes do Carnaval",
      "concentração": "2017-02-19T08:00:00-03:00",
      "desfile": "2017-02-19T10:00:00-03:00",
      "final": "2017-02-19T13:00:00-03:00",
      "local da concentracao": "Rua Primeiro de Março, entre Rua Buenos Aires e Rua do Rosário",
      "percurso": "Rua Primeiro de Março, seguindo até a Av. Presidente Antonio Carlos até a Rua Araújo Porto Alegre, onde encerra",
      "público estimado": "400000",
      "ano do primeiro desfile": "2010"
    },
    {
      "bloco": "Chora Me Liga",
      "bairro": "Copacabana",
      "região": "Zona Sul",
      "data": "19/02/17",
      "data relativa": "Domingo - 1 semana antes do Carnaval",
      "concentração": "2017-02-19T08:00:00-03:00",
      "desfile": "2017-02-19T10:00:00-03:00",
      "final": "2017-02-19T14:00:00-03:00",
      "local da concentracao": "Avenida Atlântica, altura do Posto 5",
      "percurso": "Avenida Atlântica, do Posto 5 até a Rua Figueiredo Magalhães",
      "público estimado": "100000",
      "ano do primeiro desfile": "2010"
    },
    {
      "bloco": "Gigantes da Lira",
      "bairro": "Laranjeiras",
      "região": "Zona Sul",
      "data": "19/02/17",
      "data relativa": "Domingo - 1 semana antes do Carnaval",
      "concentração": "2017-02-19T08:00:00-03:00",
      "desfile": "2017-02-19T09:00:00-03:00",
      "final": "2017-02-19T14:00:00-03:00",
      "local da concentracao": "Praça Jardim Laranjeiras - Rua General Glicério",
      "percurso": "Rua General Glicério, Rua General Cristóvão Barcelos, retornando à Praça Jardim Laranjeiras",
      "público estimado": "8000",
      "ano do primeiro desfile": "1999"
    },
    {
      "bloco": "Imagininho",
      "bairro": "Leblon",
      "região": "Zona Sul",
      "data": "19/02/17",
      "data relativa": "Domingo - 1 semana antes do Carnaval",
      "concentração": "2017-02-19T08:00:00-03:00",
      "desfile": "2017-02-19T08:00:00-03:00",
      "final": "2017-02-19T14:00:00-03:00",
      "local da concentracao": "Praça Claudio Coutinho",
      "percurso": "Parado",
      "público estimado": "200",
      "ano do primeiro desfile": "2017 (2012)"
    },
    {
      "bloco": "Suvaco do Cristo",
      "bairro": "Jardim Botânico",
      "região": "Zona Sul",
      "data": "19/02/17",
      "data relativa": "Domingo - 1 semana antes do Carnaval",
      "concentração": "2017-02-19T08:00:00-03:00",
      "desfile": "2017-02-19T10:00:00-03:00",
      "final": "2017-02-19T13:00:00-03:00",
      "local da concentracao": "Rua Jardim Botânico, esquina com Rua Faro",
      "percurso": "Rua Jardim Botânico, da Rua Faro até a Praça Santos Dumont",
      "público estimado": "30000",
      "ano do primeiro desfile": "1986"
    },
    {
      "bloco": "Fogo e Paixão",
      "bairro": "Centro",
      "região": "Centro",
      "data": "19/02/17",
      "data relativa": "Domingo - 1 semana antes do Carnaval",
      "concentração": "2017-02-19T08:30:00-03:00",
      "desfile": "2017-02-19T09:30:00-03:00",
      "final": "2017-02-19T14:30:00-03:00",
      "local da concentracao": "Largo de São Francisco",
      "percurso": "Largo de São Francisco - Parado",
      "público estimado": "12000",
      "ano do primeiro desfile": "2011"
    },
    {
      "bloco": "Acorda e vem Brincar",
      "bairro": "Vila Valqueire",
      "região": "Barra/JPA",
      "data": "19/02/17",
      "data relativa": "Domingo - 1 semana antes do Carnaval",
      "concentração": "2017-02-19T09:00:00-03:00",
      "desfile": "2017-02-19T11:00:00-03:00",
      "final": "2017-02-19T15:00:00-03:00",
      "local da concentracao": "Rua das Dálias",
      "percurso": "Rua das Dálias, Rua das Verbenas, Rua das Camélias e Rua das Dálias",
      "público estimado": "2500",
      "ano do primeiro desfile": "2007"
    },
    {
      "bloco": "Empolga às 9",
      "bairro": "Ipanema",
      "região": "Zona Sul",
      "data": "19/02/17",
      "data relativa": "Domingo - 1 semana antes do Carnaval",
      "concentração": "2017-02-19T09:00:00-03:00",
      "desfile": "2017-02-19T11:00:00-03:00",
      "final": "2017-02-19T14:00:00-03:00",
      "local da concentracao": "Praia de Ipanema, Posto 9",
      "percurso": "Praia de Ipanema, Posto 9 - Parado",
      "público estimado": "30000",
      "ano do primeiro desfile": "2003"
    },
    {
      "bloco": "Mini Bloco",
      "bairro": "Barra da Tijuca",
      "região": "Barra/JPA",
      "data": "19/02/17",
      "data relativa": "Domingo - 1 semana antes do Carnaval",
      "concentração": "2017-02-19T09:00:00-03:00",
      "desfile": "2017-02-19T09:00:00-03:00",
      "final": "2017-02-19T14:00:00-03:00",
      "local da concentracao": "Praça do Pomar",
      "percurso": "Parado",
      "público estimado": "800",
      "ano do primeiro desfile": "2017"
    },
    {
      "bloco": "Bloco das Cacheadas",
      "bairro": "Tijuca",
      "região": "Tijuca e Adj",
      "data": "19/02/17",
      "data relativa": "Domingo - 1 semana antes do Carnaval",
      "concentração": "2017-02-19T10:00:00-03:00",
      "desfile": "2017-02-19T11:00:00-03:00",
      "final": "2017-02-19T14:00:00-03:00",
      "local da concentracao": "Rua Barão de Mesquita, 280",
      "percurso": "Rua Barão de Mesquita, Rua General Roca e Praça Saens Peña",
      "público estimado": "2000",
      "ano do primeiro desfile": "2013"
    },
    {
      "bloco": "Miss Bellydance Brasil",
      "bairro": "Méier",
      "região": "Zona Norte 2",
      "data": "19/02/17",
      "data relativa": "Domingo - 1 semana antes do Carnaval",
      "concentração": "2017-02-19T10:00:00-03:00",
      "desfile": "2017-02-19T10:00:00-03:00",
      "final": "2017-02-19T13:00:00-03:00",
      "local da concentracao": "Praça Agripino Grieco",
      "percurso": "Praça Agripino Grieco",
      "público estimado": "500",
      "ano do primeiro desfile": "2016"
    },
    {
      "bloco": "Se não quiser me dar, me empresta",
      "bairro": "Ipanema",
      "região": "Zona Sul",
      "data": "19/02/17",
      "data relativa": "Domingo - 1 semana antes do Carnaval",
      "concentração": "2017-02-19T10:00:00-03:00",
      "desfile": "2017-02-19T11:00:00-03:00",
      "final": "2017-02-19T16:00:00-03:00",
      "local da concentracao": "Praia de Ipanema Posto 8",
      "percurso": "Praia de Ipanema, do Posto 8 até o Quiosque da Rua Vinivius de Moraes",
      "público estimado": "10000",
      "ano do primeiro desfile": "2005"
    },
    {
      "bloco": "Escravos da Mauá",
      "bairro": "Saúde",
      "região": "Centro",
      "data": "19/02/17",
      "data relativa": "Domingo - 1 semana antes do Carnaval",
      "concentração": "2017-02-19T11:00:00-03:00",
      "desfile": "2017-02-19T13:00:00-03:00",
      "final": "2017-02-19T17:00:00-03:00",
      "local da concentracao": "Largo São Francisco da Prainha",
      "percurso": "Rua Sacadura Cabral, Rua Barão de Tefé, Avenida Venezuela, Rua Sacadura Cabral e Largo São Francisco da Prainha",
      "público estimado": "10000",
      "ano do primeiro desfile": "1993"
    },
    {
      "bloco": "Quem Num Guenta Bebe Água",
      "bairro": "Laranjeiras",
      "região": "Zona Sul",
      "data": "19/02/17",
      "data relativa": "Domingo - 1 semana antes do Carnaval",
      "concentração": "2017-02-19T12:00:00-03:00",
      "desfile": "2017-02-19T14:00:00-03:00",
      "final": "2017-02-19T18:00:00-03:00",
      "local da concentracao": "Rua Gago Coutinho, esquina com Rua Marquesa de Santos",
      "percurso": "Largo do Machado, Ruadas Laranjeiras, Mercado São José das Artes, Retorno a origem.",
      "público estimado": "4000",
      "ano do primeiro desfile": "2004"
    },
    {
      "bloco": "Vem Tomar no Zóio",
      "bairro": "Vargem Grande",
      "região": "Barra/JPA",
      "data": "19/02/17",
      "data relativa": "Domingo - 1 semana antes do Carnaval",
      "concentração": "2017-02-19T12:00:00-03:00",
      "desfile": "2017-02-19T12:00:00-03:00",
      "final": "2017-02-19T17:00:00-03:00",
      "local da concentracao": "Est. Do Sacarrão s/n (Bar do Zóio)",
      "percurso": "Parado",
      "público estimado": "1000",
      "ano do primeiro desfile": "2017"
    },
    {
      "bloco": "Banda da Barra",
      "bairro": "Barra da Tijuca",
      "região": "Barra/JPA",
      "data": "19/02/17",
      "data relativa": "Domingo - 1 semana antes do Carnaval",
      "concentração": "2017-02-19T13:00:00-03:00",
      "desfile": "2017-02-19T15:00:00-03:00",
      "final": "2017-02-19T19:00:00-03:00",
      "local da concentracao": "Avenida Lúcio Costa, em frente ao no 3.600 - Bondinho da Banda da Barra",
      "percurso": "Avenida Lúcio Costa, do no 3.600 até a Praça São Perpétuo",
      "público estimado": "35000",
      "ano do primeiro desfile": "1984"
    },
    {
      "bloco": "Meu Glorioso São Cristóvão",
      "bairro": "São Cristóvão",
      "região": "Centro",
      "data": "19/02/17",
      "data relativa": "Domingo - 1 semana antes do Carnaval",
      "concentração": "2017-02-19T13:00:00-03:00",
      "desfile": "2017-02-19T14:00:00-03:00",
      "final": "2017-02-19T18:00:00-03:00",
      "local da concentracao": "Rua General Bruce, no 551",
      "percurso": "Segue pela Rua Senador Alencar, Rua Gal. José Cristino, Ladeira São Januário até Rua Gal. Bruce 586.",
      "público estimado": "2000",
      "ano do primeiro desfile": "2015"
    },
    {
      "bloco": "Pipoca no Mel",
      "bairro": "Gamboa",
      "região": "Centro",
      "data": "19/02/17",
      "data relativa": "Domingo - 1 semana antes do Carnaval",
      "concentração": "2017-02-19T13:00:00-03:00",
      "desfile": "2017-02-19T15:00:00-03:00",
      "final": "2017-02-19T19:00:00-03:00",
      "local da concentracao": "Praça Coronel Assumpção (Praça da Harmonia)",
      "percurso": "Rua Sacadura Cabral, Rua do Livramento, Rua Rivadavia Correa, Rua Pedro Ernesto e retorna para Praça da Harmonia",
      "público estimado": "500",
      "ano do primeiro desfile": "2009"
    },
    {
      "bloco": "Timoneiros da Viola",
      "bairro": "Madureira",
      "região": "Zona Norte 1",
      "data": "19/02/17",
      "data relativa": "Domingo - 1 semana antes do Carnaval",
      "concentração": "2017-02-19T13:00:00-03:00",
      "desfile": "2017-02-19T15:00:00-03:00",
      "final": "2017-02-19T19:00:00-03:00",
      "local da concentracao": "Praça Paulo da Portela",
      "percurso": "Praça Paulo da Portela - Parado",
      "público estimado": "15000",
      "ano do primeiro desfile": "2012"
    },
    {
      "bloco": "Batucada do Nosso Bloco",
      "bairro": "Campo Grande",
      "região": "Zona Oeste",
      "data": "19/02/17",
      "data relativa": "Domingo - 1 semana antes do Carnaval",
      "concentração": "2017-02-19T14:00:00-03:00",
      "desfile": "2017-02-19T16:00:00-03:00",
      "final": "2017-02-19T18:00:00-03:00",
      "local da concentracao": "Largo do Rio da Prata",
      "percurso": "Parado",
      "público estimado": "2000",
      "ano do primeiro desfile": "2017"
    },
    {
      "bloco": "Fala Bobagem",
      "bairro": "Vila da Penha",
      "região": "Zona Norte 1",
      "data": "19/02/17",
      "data relativa": "Domingo - 1 semana antes do Carnaval",
      "concentração": "2017-02-19T14:00:00-03:00",
      "desfile": "2017-02-19T16:00:00-03:00",
      "final": "2017-02-19T20:00:00-03:00",
      "local da concentracao": "Praça Paulo Setúbal",
      "percurso": "Desfile no entorno da Praça Paulo Setúbal",
      "público estimado": "800",
      "ano do primeiro desfile": "2014"
    },
    {
      "bloco": "O Fervo",
      "bairro": "Estácio",
      "região": "Centro",
      "data": "19/02/17",
      "data relativa": "Domingo - 1 semana antes do Carnaval",
      "concentração": "2017-02-19T14:00:00-03:00",
      "desfile": "2017-02-19T18:00:00-03:00",
      "final": "2017-02-19T20:00:00-03:00",
      "local da concentracao": "Rua Maia de Lacerda, esquina com Rua Estácio de Sá",
      "percurso": "Rua Maia de Lacerda, da esquina da Rua Estácio de Sá até a Rua Sampaio Ferraz",
      "público estimado": "2000",
      "ano do primeiro desfile": "2016"
    },
    {
      "bloco": "Fuzuê da Ilha",
      "bairro": "Jardim Guanabara",
      "região": "Zona Norte 3",
      "data": "19/02/17",
      "data relativa": "Domingo - 1 semana antes do Carnaval",
      "concentração": "2017-02-19T14:00:00-03:00",
      "desfile": "2017-02-19T15:00:00-03:00",
      "final": "2017-02-19T19:00:00-03:00",
      "local da concentracao": "Praça do Grego",
      "percurso": "Rua Uça, da Praça do Grego até a Rua Engenheiro Rozauro Zambrano, voltandoao local de concentração",
      "público estimado": "1000",
      "ano do primeiro desfile": "2009"
    },
    {
      "bloco": "Garganta Seca de Irajá",
      "bairro": "Irajá",
      "região": "Zona Norte 1",
      "data": "19/02/17",
      "data relativa": "Domingo - 1 semana antes do Carnaval",
      "concentração": "2017-02-19T14:00:00-03:00",
      "desfile": "2017-02-19T17:00:00-03:00",
      "final": "2017-02-19T20:00:00-03:00",
      "local da concentracao": "Rua Manoel de Araújo",
      "percurso": "Rua Manoel de Araújo, Rua Hanibal Porto até a Estrada da Água Grande",
      "público estimado": "350",
      "ano do primeiro desfile": "2002"
    },
    {
      "bloco": "Quem Vai Vai, Quem Não Vai Não Cagueta!",
      "bairro": "Jardim Guanabara",
      "região": "Zona Norte 3",
      "data": "19/02/17",
      "data relativa": "Domingo - 1 semana antes do Carnaval",
      "concentração": "2017-02-19T14:00:00-03:00",
      "desfile": "2017-02-19T17:00:00-03:00",
      "final": "2017-02-19T20:00:00-03:00",
      "local da concentracao": "Praça Jerusalém",
      "percurso": "Praça Jerusalem, Praia da Bica até Quiosque do Mexicano",
      "público estimado": "5000",
      "ano do primeiro desfile": "2011"
    },
    {
      "bloco": "Tamo Junto in Folia",
      "bairro": "Padre Miguel",
      "região": "Zona Oeste",
      "data": "19/02/17",
      "data relativa": "Domingo - 1 semana antes do Carnaval",
      "concentração": "2017-02-19T14:00:00-03:00",
      "desfile": "2017-02-19T16:00:00-03:00",
      "final": "2017-02-19T20:00:00-03:00",
      "local da concentracao": "Rua Marechal Marciano, esquina com Santana de Ipanema (Praça das Juras)",
      "percurso": "Parado",
      "público estimado": "50000",
      "ano do primeiro desfile": "2005"
    },
    {
      "bloco": "Banda do Arroxo",
      "bairro": "Copacabana",
      "região": "Zona Sul",
      "data": "19/02/17",
      "data relativa": "Domingo - 1 semana antes do Carnaval",
      "concentração": "2017-02-19T15:00:00-03:00",
      "desfile": "2017-02-19T17:00:00-03:00",
      "final": "2017-02-19T21:00:00-03:00",
      "local da concentracao": "Rua Belfort Roxo, esquina com a Rua Ministro Viveiros de Castro",
      "percurso": "Rua Belfort Roxo, Rua Felipe de Oliveira, Av. Princesa Isabel, Rua Ministro Viveiros de Castro até Origem.",
      "público estimado": "2000",
      "ano do primeiro desfile": "1983"
    },
    {
      "bloco": "Bigode Esticado",
      "bairro": "Méier",
      "região": "Zona Norte 2",
      "data": "19/02/17",
      "data relativa": "Domingo - 1 semana antes do Carnaval",
      "concentração": "2017-02-19T15:00:00-03:00",
      "desfile": "2017-02-19T15:00:00-03:00",
      "final": "2017-02-19T21:00:00-03:00",
      "local da concentracao": "Rua Dias da Cruz, no 255",
      "percurso": "Rua Dias da Cruz, do no 255 até a Rua Hermengarda, voltando a concentração",
      "público estimado": "1000",
      "ano do primeiro desfile": "1999"
    },
    {
      "bloco": "Banda da Amizade",
      "bairro": "Lapa",
      "região": "Centro",
      "data": "19/02/17",
      "data relativa": "Domingo - 1 semana antes do Carnaval",
      "concentração": "2017-02-19T15:00:00-03:00",
      "desfile": "2017-02-19T18:00:00-03:00",
      "final": "2017-02-19T23:00:00-03:00",
      "local da concentracao": "Rua Tadeu Kosciusco",
      "percurso": "Rua Tadeu Kosciusko, Rua do Rezende, Rua Ubaldino do Amaral, Rua Washington Luiz, Rua Carlos Sampaio e Rua Tadeu Kosciusko",
      "público estimado": "1000",
      "ano do primeiro desfile": "1988"
    },
    {
      "bloco": "Incha Rola",
      "bairro": "Anil",
      "região": "Barra/JPA",
      "data": "19/02/17",
      "data relativa": "Domingo - 1 semana antes do Carnaval",
      "concentração": "2017-02-19T15:00:00-03:00",
      "desfile": "2017-02-19T17:00:00-03:00",
      "final": "2017-02-19T20:00:00-03:00",
      "local da concentracao": "Rua Araticum, 603",
      "percurso": "Rua Araticum, Estrada de Jacarepaguá e Praça Jornalista Geysa Boscoli",
      "público estimado": "2000",
      "ano do primeiro desfile": "1999"
    },
    {
      "bloco": "Larga a Onça, Alfredo!",
      "bairro": "Laranjeiras",
      "região": "Zona Sul",
      "data": "19/02/17",
      "data relativa": "Domingo - 1 semana antes do Carnaval",
      "concentração": "2017-02-19T15:00:00-03:00",
      "desfile": "2017-02-19T18:00:00-03:00",
      "final": "2017-02-19T20:00:00-03:00",
      "local da concentracao": "Rua Ipiranga, em frente ao no 49",
      "percurso": "Rua Ipiranga, Rua Esteves Junior e Praça São Salvador",
      "público estimado": "3000",
      "ano do primeiro desfile": "2008"
    },
    {
      "bloco": "Eu Choro Curto Mas Rio Comprido",
      "bairro": "Rio Comprido",
      "região": "Centro",
      "data": "19/02/17",
      "data relativa": "Domingo - 1 semana antes do Carnaval",
      "concentração": "2017-02-19T15:00:00-03:00",
      "desfile": "2017-02-19T17:00:00-03:00",
      "final": "2017-02-19T21:00:00-03:00",
      "local da concentracao": "Rua Aristides Lobo, 250",
      "percurso": "Rua Aristides Lobo, da Rua Campos da Paz até a Rua Barão de Itapagipe, retornando pela Aristides Lobo até a concentração",
      "público estimado": "1500",
      "ano do primeiro desfile": "2008"
    },
    {
      "bloco": "Foliões da Prainha",
      "bairro": "Saúde",
      "região": "Centro",
      "data": "19/02/17",
      "data relativa": "Domingo - 1 semana antes do Carnaval",
      "concentração": "2017-02-19T15:00:00-03:00",
      "desfile": "2017-02-19T15:00:00-03:00",
      "final": "2017-02-19T21:00:00-03:00",
      "local da concentracao": "Largo São Francisco da Prainha",
      "percurso": "Largo São Francisco da Prainha - Parado",
      "público estimado": "500",
      "ano do primeiro desfile": "2016"
    },
    {
      "bloco": "Tá Pirando, Pirado, Pirou!",
      "bairro": "Urca",
      "região": "Zona Sul",
      "data": "19/02/17",
      "data relativa": "Domingo - 1 semana antes do Carnaval",
      "concentração": "2017-02-19T15:00:00-03:00",
      "desfile": "2017-02-19T16:00:00-03:00",
      "final": "2017-02-19T21:00:00-03:00",
      "local da concentracao": "Av. Pasteur, em frente ao Instituto Benjamim Constant, no 404",
      "percurso": "Av. Pasteur, do Instituto Benjamim Constant até a Praca General Tibúrcio",
      "público estimado": "1500",
      "ano do primeiro desfile": "2005"
    },
    {
      "bloco": "Vai Tomar no Grajaú",
      "bairro": "Grajaú",
      "região": "Tijuca e Adj",
      "data": "19/02/17",
      "data relativa": "Domingo - 1 semana antes do Carnaval",
      "concentração": "2017-02-19T15:00:00-03:00",
      "desfile": "2017-02-19T17:00:00-03:00",
      "final": "2017-02-19T21:00:00-03:00",
      "local da concentracao": "Av. Engenheiro Richard 110",
